id,year,citations,versions,title
3855111392639001459,2005,622,75,Analogue gravity
6487240665886745888,2011,113,7,Hořava-Lifshitz gravity: a status report
11889097186149171613,2012,89,16,Nonperturbative quantum gravity
5427255336912011204,2011,65,12,General covariance in gravity at a Lifshitz point
16894024050615869805,2011,53,12,An alternative approach for general covariant Hořava–Lifshitz gravity and matter coupling
10304956170576941060,2011,49,8,Stability of spin-0 graviton and strong coupling in Horava-Lifshitz theory of gravity
2176298576388217225,2012,49,7,Conformal Lifshitz gravity from holography
5873907256195193752,2004,331,12,LISA capture sources: Approximate waveforms  signal-to-noise ratios  and parameter estimation accuracy
8646775136582914831,2012,27,8,Asymptotically (anti-) de Sitter black holes and wormholes with a self-interacting scalar field in four dimensions
5152560453037990608,2012,12,8,Black holes with primary hair in gauged N= 8 supergravity
8773646528349584647,2013,5,7,Dynamical compactification in Einstein-Gauss-Bonnet gravity from geometric frustration
9092777675402380971,2014,5,7,Thermodynamics of Lovelock black holes with a nonminimal scalar field
4897292671366863584,2013,4,6,All the solutions of the form M2× WΣd− 2 for Lovelock gravity in vacuum in the Chern-Simons case
11483041812728212612,2014,1,2,The different phases of hairy black holes in AdS5 space
6419054454887564328,2014,1,6,Cosmological dynamics in higher-dimensional Einstein–Gauss–Bonnet gravity
13619457425574358901,2014,1,7,Stability and existence analysis of static black holes in pure Lovelock theories
14080224725379899386,2012,135,15,Towards singularity-and ghost-free theories of gravity
1669455604764693286,2013,38,8,DBI Galileons in the Einstein frame: Local gravity and cosmology
15009000113608156560,2012,30,11,Direct imaging rapidly-rotating non-Kerr black holes
3566565022121786442,2013,30,10,Diffusion in multiscale spacetimes
1140227840793515893,2011,29,8,Can an astrophysical black hole have a topologically non-trivial event horizon?
12545523963166483704,2012,27,17,On bouncing solutions in non-local gravity
7692644515454561045,2013,5,7,Large deformation and adhesive contact studies of axisymmetric membranes
14038097043468877273,2013,5,4,Uniaxial deformation and orientation of ethylene–tetrafluoroethylene films
9849386266278666623,2013,2,3,Lightweight envelopes: ethylene tetra-fluoro-ethylene foil in architecture
3790011616130668824,2013,1,2,Adhesive blister propagation under an orthotropic bituminous waterproofing membrane
16780632454141592652,2014,2,0,Uniaxial cyclic tensile mechanical properties of ethylene tetrafluoroethylene (ETFE) foils
16834916542594445292,2013,1,0,Transfer molding of primary LED optics; High aspect ratio domes
3403824982771970835,2012,1,2,Out-of-plane biaxial tests of ther-moplastics
15311617092144046707,2014,1,0,A new biaxial compression fixture for polymeric foams
1091896542169133485,2006,197,14,Dark energy and dark matter as curvature effects?
5808760797275434483,2007,124,12,Newtonian limit of f (R) gravity
5667680941894582904,2007,70,13,Stability of the Einstein static universe in f (R) gravity
16222016402319765681,2008,64,11,Spherical symmetry in f (R)-gravity
18100741406782346299,2009,61,10,Exact solutions of Bianchi-type I and V spacetimes in the f (R) theory of gravity
6786917481458553162,2012,29,14,Identification of plastic constitutive parameters at large deformations from three dimensional displacement fields
10599182333705339947,2010,23,6,Extension of the virtual fields method to elasto-plastic material identification with cyclic loads and kinematic hardening
8782562942510232714,2011,14,0,Virtual fields method on planar tension tests for hyperelastic materials characterisation
12565691097588931912,2012,13,6,Membrane curvatures and stress-strain full fields of axisymmetric bulge tests from 3D-DIC measurements. Theory and validation on virtual and experimental results
11870686634965168676,2012,13,4,A Review of the Challenges and Limitations of Full‐Field Measurements Applied to Large Heterogeneous Deformations of Rubbers
10206011084740796585,2012,10,0,Improving the characterization of a hardening law using digital image correlation over an enhanced heterogeneous tensile test
10345170492302188376,2012,9,8,Out-of-plane testing procedure for inverse identification purpose: Application in sheet metal plasticity
1043115591182005073,2012,9,6,Combining displacement  strain  temperature and heat source fields to investigate the thermomechanical response of an elastomeric specimen subjected to large  …
10681210277987735,2011,6,4,Parameters identification of polymer concrete using a fracture mechanics test method and full-field measurements
4116373269093634807,2003,418,10,Foundations of classical electrodynamics: Charge  flux  and metric
11317434661648403864,2008,79,10,Corrections to Schwarzschild solution in noncommutative gauge theory of gravity
3556418067959681287,2007,79,13,Elie Cartan's torsion in geometry and in field theory  an essay
7174289403605574252,2012,76,9,Teleparallel Gravity: An Introduction
11741418948951098536,2008,66,11,Torsion cosmology and the accelerating universe
17827755111064352570,2012,13,5,Competition among Ca2+  Mg2+  and Na+ for model ion channel selectivity filters: determinants of ion selectivity
6923082431711304530,2013,10,15,Multi-ion conduction bands in a simple model of calcium ion channels
15525031915783928277,2013,6,11,Ionic interactions in biological and physical systems: a variational treatment
3198430355329398234,2013,5,15,Energetics of discrete selectivity bands and mutation-induced transitions in the calcium-sodium ion channels family
12992089589442401716,2012,5,6,Localizing the charged side chains of ion channels within the crowded charge models
18416901235257452161,2013,5,4,The role of solvation in the binding selectivity of the L-type calcium channel
9940872705722560203,2013,14,6,An alternative f (R  T) gravity theory and the dark energy problem
8742062704943337479,2013,12,15,The virial theorem and the dark matter problem in hybrid metric-Palatini gravity
6999830030269798216,2013,7,9,Galactic rotation curves in hybrid metric-Palatini gravity
5156234165522142911,2013,6,8,Einstein static universe in hybrid metric-Palatini gravity
7193420666658241942,2012,25,9,Black holes with nonminimal derivative coupling
16104836327410858418,2013,24,9,Nonlinear structure formation in the Cubic Galileon gravity model
447713087754611987,2013,23,12,Parameter space in Galileon gravity models
29083882684312411,2012,19,9,The cosmology of the Fab-Four
1666912506954086696,2012,17,5,Realistic cosmological scenario with nonminimal kinetic coupling
16493082857464626131,2013,12,8,Cosmology with nonminimal kinetic coupling and a power-law potential
14665756943441254801,2013,8,7,Cosmology with non-minimal derivative couplings: perturbation analysis and observational constraints
4794002541216037612,1998,617,9,A millisecond pulsar in an X-ray binary system
3634208597493161040,1998,348,8,Crustal heating and quiescent emission from transiently accreting neutron stars
17812572677435290757,1999,291,6,kHz quasiperiodic oscillations in low-mass X-ray binaries as probes of general relativity in the strong-field regime
17990480599072979442,2001,288,15,A catalogue of low-mass X-ray binaries
11714527618513922238,1999,263,12,Is SAX J1808. 4-3658 a strange star?
16072202439981820671,2011,29,9,Aspects of noncommutative (1+ 1)-dimensional black holes
14280302561770491296,2013,24,4,Non-singular quantum-inspired gravitational collapse
5724950180546897369,2011,28,6,Biomechanics of the tympanic membrane
1470748300360829555,2012,12,3,Mechanical properties of human tympanic membrane in the quasi-static regime from in situ point indentation measurements
6519534191866520855,2012,11,7,Static versus dynamic gerbil tympanic membrane elasticity: derivation of the complex modulus
16941242532018943240,2013,7,18,In vivo optic nerve head biomechanics: performance testing of a three-dimensional tracking algorithm
4283268537308745647,2011,7,15,Determination and validation of the elastic moduli of small and complex biological samples: bone and keratin in bird beaks
8013758509125506912,2011,5,6,Elastic characterization of the gerbil pars flaccida from in situ inflation experiments
11095764575783332762,2013,2,7,Identification of quasi-optimal regions in the design space using surrogate modeling
10063408399613646566,2014,2,7,An engineered membrane to measure electroporation: Effect of tethers and bioelectronic interface
6433129635076510967,2013,1,2,Characterization and modeling of geometric variations in McKibben pneumatic artificial muscles
16552641553060287708,2011,1,2,On Auxetic Versus Non-auxetic Indentation by a Rigid Conical Cylinder
3305672720318019788,2013,18,6,Simulations of cyclic voltammetry for electric double layers in asymmetric electrolytes: a generalized modified Poisson–Nernst–Planck model
2337583879411164810,2012,12,4,Biomolecular electrostatics—I want your solvation (model)
12244981096166291444,2012,8,7,A new approach to the Lennard-Jones potential and a new model: PNP-steric equations
5378267773476249986,2011,8,8,Lateral dynamics of charged lipids and peripheral proteins in spatially heterogeneous membranes: Comparison of continuous and Monte Carlo approaches
16707938175837214664,2012,8,9,Competitive adsorption and ordered packing of counterions near highly charged surfaces: From mean-field theory to Monte Carlo simulations
7049840061525097835,2013,8,6,Progress in developing Poisson-Boltzmann equation solvers
843577183555952752,2013,7,6,Electrostatic forces in the Poisson-Boltzmann systems
8732745711875803466,2008,149,10,Curvilinear immersed boundary method for simulating fluid structure interaction with complex 3D rigid bodies
9979863666798956327,2007,86,4,Vorticity dynamics of a bileaflet mechanical heart valve in an axisymmetric aorta
17942523562761017101,2009,56,11,A review of state-of-the-art numerical methods for simulating flow through mechanical heart valves
16841468626360647457,2010,36,13,Towards non-thrombogenic performance of blood recirculating devices
10068872018957668793,2010,17,11,Flow interactions with cells and tissues: cardiovascular flows and fluid–structure interactions
4994995755599580726,2011,17,23,Tortuosity triggers platelet activation and thrombus formation in microvessels
7852280454814115506,2010,16,22,The effect of implantation orientation of a bileaflet mechanical heart valve on kinematics and hemodynamics in an anatomic aorta
3445522632686382402,2009,13,3,Numerical analysis on the hemodynamics and leaflet dynamics in a bileaflet mechanical heart valve using a fluid-structure interaction method
850437681763086365,2010,13,9,Role of computational simulations in heart valve dynamics and design of valvular prostheses
10421890175555138151,2011,25,4,Adhesive particulate flow: The discrete-element method and its application in energy and environmental engineering
6069448074645867873,2011,24,13,Spheres in the vicinity of a bifurcation: elucidating the Zweifach–Fung effect
244620122416285106,2012,17,7,The effect of red blood cell aggregation on velocity and cell-depleted layer characteristics of blood in a bifurcating microchannel
4624620352180341562,2012,15,11,Blood–plasma separation in Y-shaped bifurcating microfluidic channels: a dissipative particle dynamics simulation study
5415557710421942831,2011,8,3,Plasma expander viscosity effects on red cell-free layer thickness after moderate hemodilution
17449367778138355850,2013,3,9,Effect of red blood cells on platelet activation and thrombus formation in tortuous arterioles
6294428828205035106,2013,3,7,Temporal multiscale approach for nanocarrier motion with simultaneous adhesion and hydrodynamic interactions in targeted drug delivery
800237998288505264,2013,1,3,Comparison of methods for computing the concentration field of a particulate flow
16613179856476203265,2002,288,10,The dS/CFT correspondence and the big smash
17424126031379176406,2003,247,7,Generalized Israel junction conditions for a Gauss-Bonnet brane world
7281958372700812421,2003,246,10,Energy in generic higher curvature gravity theories
2553480685139540315,2009,206,11,Topological black holes in Hořava-Lifshitz gravity
11039430527899066819,2006,178,11,Entropy function for heterotic black holes
666261769277462975,2002,171,12,Gravitational energy in quadratic-curvature gravities
6643160681251049319,2008,193,18,Science with ASKAP
6065916034074066189,2006,148,12,Stellar remnants in galactic nuclei: mass segregation
4600356050213885087,2008,135,59,Probes and tests of strong-field gravity with observations in the electromagnetic spectrum
11120295695332445993,2006,134,15,Arecibo pulsar survey using alfa. i. survey strategy and first discoveries
6417177072161026056,2009,91,6,Pulsar searches and timing with the square kilometre array
12113723546476241147,2008,62,3,The double pulsar
17291660972895378084,2008,61,11,The population of pulsars with interpulses and the implications for beam evolution
3211664004834154045,2013,21,8,Semiclassical geons as solitonic black hole remnants
13961511843885350533,2014,20,13,Geonic black holes and remnants in Eddington-inspired Born-Infeld gravity
10587017091177786166,2013,15,9,Importance of torsion and invariant volumes in Palatini theories of gravity
16754032069906573703,2013,6,9,Nonsingular electrovacuum solutions with dynamically generated cosmological constant
14040214814652392385,2014,5,12,Microscopic wormholes and the geometry of entanglement
911989803188109126,2014,5,11,Planck scale physics and topology change through an exactly solvable model
8237046701563465315,2012,3,3,Extended Theories of Gravitation and the Curvature of the Universe-Do We Really Need Dark Matter?
11784786480640548434,2006,48,16,Superfluid He 4 interferometer operating near 2 K
11730050191795151114,2011,45,4,How to detect the chandler and the annual wobble of the earth with a large ring laser gyroscope
3390145907282741702,2006,41,22,Coherent matter wave inertial sensors for precision measurements in space
4458733080954261504,2012,89,8,Quantum black holes  wall crossing  and mock modular forms
10349428504723677759,2004,85,14,Modular bootstrap for boundary Script N= 2 Liouville theory
9060200248019524350,2004,51,12,The partition function of the supersymmetric two-dimensional black hole and little string theory
2176603262409702238,2014,47,12,2d Index and Surface operators
12639267907508635539,2005,46,10,D-branes and extended characters in SL (2  R)/U (1)
13480858434793244877,2010,40,11,The non-compact elliptic genus: mock or modular
13015777088363113912,2005,37,9,D-branes and SQCD in non-critical superstring theory
3799040548964602936,2006,34,18,D-branes in non-critical superstrings and minimal super-Yang–Mills in various dimensions
12707817199051654356,2012,170,21,eLISA: Astrophysics and cosmology in the millihertz regime
232108896729186992,2010,166,12,Electromagnetic counterparts of compact object mergers powered by the radioactive decay of r-process nuclei
4685038425401383616,2012,164,8,What is the most promising electromagnetic counterpart of a neutron star binary merger?
6573485566376377083,2006,148,12,Measuring coalescing massive binary black holes with gravitational waves: The impact of spin-induced precession
10477054220264422549,2008,137,11,An eccentric circumbinary accretion disk and the detection of binary massive black holes
10870006090162552817,2012,130,40,Low-frequency gravitational-wave science with eLISA/NGO
16031745701516039794,2007,126,11,The imprint of massive black hole formation models on the LISA data stream
12001176579250306719,1996,3178,10,Review of particle physics. particle data group
1403184261138517879,1984,1726,7,Theory of extragalactic radio sources
12025902712107259999,1995,1137,9,Pierre-Simon Laplace Philosophical Essay on Probabilities
1396156403198083853,1985,819,15,Radio emission from the sun and stars
5781777054994628633,1984,701,7,Discovery of a shell around Alpha Lyrae
18272232608028741751,1984,679,12,A circumstellar disk around β Pictoris
2222860748649965358,1999,529,4,Chance and stability: stable distributions and their applications
15868792168685201743,2012,32,3,Impact of directional walk on atom probe microanalysis
16561974199400308736,2010,25,7,Impact of laser pulsing on the reconstruction in an atom probe tomography
14163193148640483951,2011,24,7,Crystallographic structural analysis in atom probe microscopy via 3D Hough transformation
3762674887697147502,2012,23,2,Atom probe crystallography
10973314697646909646,2009,19,9,Atom probe microscopy of three-dimensional distribution of silicon isotopes in Si28∕ Si30 isotope superlattices with sub-nanometer spatial resolution
6085358126277509271,2011,20,7,Atom probe crystallography: Characterization of grain boundary orientation relationships in nanocrystalline aluminium
17257972997367712686,2011,18,6,Lattice rectification in atom probe tomography: toward true three-dimensional atomic microscopy
9244520930800398042,2013,63,8,Thermodynamics  gravitational anomalies and cones
3874829855653023610,2014,56,8,On the architecture of spacetime geometry
12284804725004161600,2013,38,8,Logarithmic corrections to Schwarzschild and other non-extremal black hole entropy in different dimensions
9025016758453398888,2014,35,8,Exact results for the entanglement entropy and the energy radiated by a quark
6120518964205616630,2012,33,7,Logarithmic corrections to {\ mathcal {N}= 2} black hole entropy: an infrared window into the microstates
17903299078903537580,2012,28,9,On shape dependence and RG flow of entanglement entropy
8558949694697463741,2005,52,12,Is it possible to measure the Lense-Thirring effect on the orbits of the planets in the gravitational field of the Sun?
12590312356749761644,2004,47,9,Precise relativistic orbits in Kerr and Kerr–(anti) de Sitter spacetimes
4052202712121765496,2005,43,11,On the effects of Dvali–Gabadadze–Porrati braneworld gravity on the orbital motion of a test particle
10681129688129749079,2004,37,4,OPTIS—an Einstein mission for improved tests of special and general relativity
10606287475676028531,2013,50,5,Viscous modified cosmic Chaplygin gas cosmology
13515023455966144911,2014,41,6,Effect of varying bulk viscosity on generalized chaplygin gas
14122497912561371876,2013,21,8,Cosmological constraints on a decomposed Chaplygin gas
16152631033415526847,2014,17,7,Interacting quintessence models of dark energy
18235892192372476968,2014,16,3,Effect of shear and bulk viscosities on interacting modified Chaplygin gas cosmology
11852951357664997158,2012,14,12,Modified Chaplygin gas as a unified dark matter and dark energy model and cosmic constraints
11329793945467989480,2014,13,6,Higher derivative corrections of $ f (R) $ gravity with varying equation of state in the case of variable $ G $ and $\ Lambda$
3561583465941378213,2013,11,14,Intermediate-generalized Chaplygin gas inflationary universe model
7783193077862640305,2013,9,7,Thawing models in the presence of a generalized Chaplygin gas
13658357300270299971,2014,7,7,An effective quintessence field with a power-law potential
12696590308577635933,2014,11,8,Lovelock theory  black holes and holography
10378588760115002293,2014,9,8,Lovelock theory and the AdS/CFT correspondence
3808485886358825486,2014,10,8,Multiple reentrant phase transitions and triple points in Lovelock thermodynamics
577593444191008766,2013,8,6,Planar AdS black holes in Lovelock gravity with a nonminimal scalar field
13383688475368517326,2014,6,7,Generalized phase transitions in Lovelock gravity
9596701904631682704,2014,6,6,Conditions on holographic entangling surfaces in higher curvature gravity
15844180638595184607,2013,3,8,Cosmic censorship in Lovelock theory
2759486464090896627,2013,3,4,Phase transitions in general gravity theories
16145390705769966535,2013,2,5,Critical higher order gravities in higher dimensions
4636269351374766849,2009,145,8,On the z= 4 Hořava-Lifshitz gravity
11587421361259953497,2011,100,13,Critical points of D-dimensional extended gravities
10744877014135605568,2009,80,10,Three-dimensional black holes  gravitational solitons  kinks and wormholes for BHT massive gravity
13027142768240460171,2011,63,8,Integrated morphodynamic signalling of the mammary gland
9643567015926384353,2007,53,3,High‐frequency ultrasonographic imaging of avian cardiovascular development
9386392095450189745,2009,42,6,High temporal resolution OCT using image-based retrospective gating
9299086944168929881,2010,36,6,Mechanics of head fold formation: investigating tissue-level forces during early development
13853164623502286786,2011,26,8,Blood flow dynamics of one cardiac cycle and relationship to mechanotransduction and trabeculation during heart looping
12506992835816802686,2008,24,18,A new method for measuring deformation of folding surfaces during morphogenesis
3954864073425187281,2008,23,31,On modeling morphogenesis of the looping heart following mechanical perturbations
7356150938453040734,2008,21,11,Bimodal biophotonic imaging of the structure-function relationship in cardiac tissue
7757372581988548314,2012,21,6,Not just inductive: a crucial mechanical role for the endoderm during heart tube assembly
16696359030495199324,2008,17,7,Microsystems for biomechanical measurements
17162156108622565821,2013,82,8,Cosmological magnetic fields: their generation  evolution and observation
15647524898945145732,2013,43,6,First lower limits on the photon-axion-like particle coupling from very high energy gamma-ray observations
11913178556840678628,2013,41,16,Radio continuum surveys with square kilometre array pathfinders
16831612448577192721,2014,33,7,Cosmic Rays in Galaxy Clusters and Their Nonthermal Emission
13818312183938528694,2013,27,11,Revisiting scaling relations for giant radio halos in galaxy clusters
9058821726065651327,2013,25,9,Giant radio relics in galaxy clusters: reacceleration of fossil relativistic electrons?
4997107383081477132,2013,24,5,Cosmological Magnetohydrodynamic Simulations of Galaxy Cluster Radio Relics: Insights and Warnings for Observations
18393454016442349612,2012,22,15,Radio halos in future surveys in the radio continuum
12003560693975915409,2013,21,12,Rise and fall of radio haloes in simulated merging galaxy clusters
15300415454193559284,2013,19,8,Challenges to our understanding of radio relics: X-ray observations of the Toothbrush cluster
8667034884412454747,2011,30,11,Direct Observation of Local Potassium Variation and Its Correlation to Electronic Inhomogeneity in (Ba 1-x K x) Fe 2 As 2 Pnictide
1759076746081591769,2012,30,0,Atom probe tomography 2012
12928353491109365430,2011,22,6,Depth and lateral resolution of laser-assisted atom probe microscopy of silicon revealed by isotopic heterostructures
16571459375064484597,2013,21,4,Contribution of atom-probe tomography to a better understanding of glass alteration mechanisms: Application to a nuclear glass specimen altered 25years in a granitic …
2497144715201094712,2011,20,8,Dynamic reconstruction for atom probe tomography
4622659644178862720,2012,18,5,The future of atom probe tomography
8283127471068479720,2008,336,10,Chiral gravity in three dimensions
17509960965810361261,2008,248,13,Black hole entropy function  attractors and precision counting of microstates
8399326140326379212,2006,198,9,Anomalies  Hawking radiations  and regularity in rotating black holes
12540647391000614845,2008,158,11,Lectures on black holes and the AdS3/CFT2 correspondence
9238636759437701291,2007,107,10,Black hole microstates and attractor without supersymmetry
17584067942980986785,2007,107,15,Black hole mass and angular momentum in topologically massive gravity
15236665364345628976,2010,812,29,Fermi large area telescope first source catalog
17595063456809834827,2010,452,36,The first Fermi Large Area Telescope catalog of gamma-ray pulsars
9039656918627526197,2011,235,11,Dark matter annihilation in the Galactic Center as seen by the Fermi Gamma Ray Space Telescope
1109122190430102258,2011,210,11,Origin of the gamma rays from the Galactic Center
13561358129040922840,2012,128,8,Detection of a gamma-ray source in the galactic center consistent with extended emission from dark matter annihilation and concentrated astrophysical emission
16343098411848124747,2010,115,11,Modeling of gamma-ray pulsar light curves using the force-free magnetic field
15289988663499686865,2010,113,17,Eight γ-ray pulsars discovered in blind frequency searches of Fermi LAT data
10966748869275338623,2009,100,15,Radio detection of LAT PSRs J1741-2054 and J2032+ 4127: no longer just gamma-ray pulsars
8141217112565074267,2006,64,14,Minkowski space-time: a glorious non-entity
1001823504802288848,2013,59,11,Tests of Lorentz invariance: a 2013 update
5695846798940454896,2013,54,22,Quantum information theory and the foundations of quantum mechanics
8171416230981671523,2009,45,10,Consistent cosmological modifications to the Einstein equations
13269428969693707162,2009,46,5,Drawing the line between kinematics and dynamics in special relativity
15575150679432237899,2010,45,2,Persistence and spacetime
3161105945738937356,2010,41,14,Quantum mechanics on spacetime I: Spacetime state realism
2692149108540846516,2010,40,10,Very special relativity as relativity of dark matter: the Elko connection
9158468238023225327,2008,34,10,Philosophical aspects of quantum information theory
4418492294325466086,2012,31,6,Philosophy of physics: Space and time
17556762901098241427,2007,1353,16,Ultracold atomic gases in optical lattices: mimicking condensed matter physics and beyond
11826703640696562536,2007,451,11,Glueballs  hybrids  multiquarks: Experimental facts versus QCD inspired concepts
944187801940299838,2006,373,11,Infrared properties of QCD from Dyson-Schwinger equations
