id,year,citations,versions,title
10793137268480257733,2007,1120,14,Class of antiretroviral drugs and the risk of myocardial infarction
14513151952104763020,2003,850,20,Cardiovascular disease risk factors in HIV patients–association with antiretroviral therapy. Results from the DAD study
1873940500152459279,2002,825,11,Antiretroviral treatment for adult HIV infection in 2002: updated recommendations of the International AIDS Society-USA Panel
13538544228628290038,2006,824,10,Tenofovir DF  emtricitabine  and efavirenz vs. zidovudine  lamivudine  and efavirenz for HIV
2479485162344085079,2008,808,7,Life expectancy of individuals on combination antiretroviral therapy in high-income countries: a collaborative analysis of 14 cohort studies
8249927419799211723,2002,689,6,Lopinavir–ritonavir versus nelfinavir for the initial treatment of HIV infection
4407942083398426137,2001,688,9,Efavirenz plasma levels can predict treatment failure and central nervous system side effects in HIV-1-infected patients
8873835776604515118,2004,685,10,Comparison of first-line antiretroviral therapy with regimens including nevirapine  efavirenz  or both drugs  plus stavudine and lamivudine: a randomised open-label  …
12145398566995214045,2002,211,4,Gravitational lensing by naked singularities
14254491827548901719,2008,123,10,Time delay and magnification centroid due to gravitational lensing by black holes and naked singularities
7854939935656826770,2009,90,10,Relativistic images of Schwarzschild black hole lensing
7779743554023265243,2000,62,10,Energy distribution in Melvin's magnetic universe
14694350762341094605,2004,30,15,Energy Distribution of a Gödel-Type Space–Time
15660067404697149308,2006,25,10,ENERGY DISTRIBUTION OF THE EINSTEIN–KLEIN–GORDON SYSTEM FOR A STATIC SPHERICALLY SYMMETRIC SPACE–TIME IN (2+ 1) DIMENSIONS
13958107198778578207,2006,24,9,GRAVITATIONAL ENERGY–MOMENTUM DENSITY IN BIANCHI TYPE II SPACE–TIMES
613635085616040104,2007,23,11,Energy distribution in a schwarzschild-like spacetime
354005273565832870,1999,318,14,Gravitating non-Abelian solitons and black holes with Yang–Mills fields
7577819950702351510,2000,139,9,String-inspired higher-curvature terms and the Randall-Sundrum scenario
12094502527810382920,2003,134,12,Israel conditions for the Gauss–Bonnet theory and the Friedmann equation on the brane universe
5570799327006854396,1999,71,8,Singularity-free cosmological solutions in quadratic gravity
6884844361670188088,2009,121,10,Self-accelerating universe in Galileon cosmology
12211128429453580553,2010,70,9,Cosmic expansion and growth histories in Galileon scalar-tensor models of dark energy
6222127306000972760,2009,59,10,Einstein-Maxwell-Dilaton theories with a Liouville potential
11909785308961612598,2012,44,6,Self-tuning and the derivation of a class of scalar-tensor theories
6642847489552733863,2009,350,67,Physics  astrophysics and cosmology with gravitational waves
8441452232188326597,2007,256,7,Crossing the phantom divide: theoretical implications and observational status
4710982001916762638,2015,1,7,RadioAstron as a target and as an instrument: Enhancing the Space VLBI mission's scientific output
2055014186644045088,2012,41,7,Slowly rotating black holes in dynamical Chern-Simons gravity: Deformation quadratic in the spin
9535110846232976373,2013,20,2,History of the attempts to measure orbital frame-dragging with artificial satellites
5622032463162676664,2014,17,7,The planetary and lunar ephemerides DE430 and DE431
12525028959396642567,2012,17,4,Are higher degree even zonals really harmful for the LARES/LAGEOS frame-dragging experiment?
15090666876876258492,2013,15,5,Novel considerations about the error budget of the LAGEOS-based tests of frame-dragging with GRACE geopotential models
13233991049079514296,2013,16,5,f (R  T) cosmological models in phase space
18371361914056229754,2014,13,5,New upper limits on deviation from the inverse-square law of gravity in the solar system: a Yukawa parameterization
16859238410322323615,2012,10,6,Dynamical orbital effects of general relativity on the satellite-to-satellite range and range-rate in the GRACE mission: A sensitivity analysis
8119740795359549095,2011,10,15,Some considerations on the present-day results for the detection of frame-dragging after the final outcome of GP-B
11074303953307119943,2010,304,9,Einstein's Other Gravity and the Acceleration of the Universe
12220910722996704362,2006,340,16,The ACS virgo cluster survey. VIII. The nuclei of early-type galaxies
3454424907182541406,2007,328,9,Large merger recoils and spin flips from generic black hole binaries
17406397711787928408,2007,278,9,Maximum kick from nonspinning black-hole binary inspiral
2631912476655839238,2007,278,10,Maximum gravitational recoil
3329624666011833352,2007,242,10,Supermassive recoil velocities for binary black-hole mergers with antialigned spins
3705888829079865646,2007,241,20,Formation of z~ 6 quasars from hierarchical galaxy mergers
16981344508262510347,2013,254,8,Coevolution (or not) of supermassive black holes and host galaxies
3847805085581473033,2006,228,11,Getting a kick out of numerical relativity
16639850281383562409,2005,204,84,Massive black hole binary evolution
10270950984617267699,2007,205,12,Alignment of the spins of supermassive black holes prior to coalescence
9593147208234182714,2012,179,11,Explosion mechanisms of core-collapse supernovae
17193171302455508818,2011,133,14,Black hole formation in failing core-collapse supernovae
6776945547766164758,2010,129,26,The third generation of gravitational wave observatories and their science reach
2649602231342131564,2010,104,36,All-sky search for gravitational-wave bursts in the first joint LIGO-GEO-Virgo run
4870479915441524513,2009,88,21,Search for gravitational-wave bursts in the first year of the fifth LIGO science run
16762603923120632189,2010,86,33,Search for gravitational-wave bursts associated with gamma-ray bursts using data from LIGO Science Run 5 and Virgo Science Run 1
16798482991321597372,2013,83,4,Colloquium: Perspectives on core-collapse supernova theory
15610554731643684402,1999,6147,25,How the mind works
16379055851253434091,1997,6107,22,The conscious mind: In search of a fundamental theory
17072471540291559292,2002,4877,53,Quantum cryptography
9883640475635863599,2000,3734,11,Design rules: The power of modularity
5011659996782581623,2000,3294,15,The meme machine
10601398814268084115,1996,3019,28,A fast quantum mechanical algorithm for database search
862967646241901538,2003,2125,9,Decoherence and the appearance of a classical world in quantum theory
13022515942196894869,2001,2072,33,A sensorimotor account of vision and visual consciousness
2961450268635110249,1996,1990,6,The firm as a distributed knowledge system: a constructionist approach
5880856215556322187,1997,1946,5,The end of certainty
12905851666279575755,2012,200,12,Hidden Fermi surfaces in compressible states of gauge-gravity duality
3161753421249317270,2012,147,13,Aspects of holography for theories with hyperscaling violation
11105922311533498962,2012,95,11,Entanglement entropy from a holographic viewpoint
13794427723326010777,2012,68,8,Holographic entanglement entropy and Fermi surfaces
5933752923058291008,2013,64,9,Thermodynamical property of entanglement entropy for excited states
12762227590454413162,2012,64,6,Lifshitz scaling and hyperscaling violation in string theory
1873040574099886203,2012,63,8,Spectral weight in holographic scaling geometries
9042598845996104340,2013,59,8,Quantum corrections to holographic entanglement entropy
18352488152420064175,2012,57,15,Bianchi attractors: a classification of extremal black brane geometries
1031040623386717681,2012,90,12,Anomaly-free scalar perturbations with holonomy corrections in loop quantum cosmology
9500956629532695782,2009,80,10,Gauge invariant cosmological perturbation equations with corrections from loop quantum gravity
11383786266166137728,2011,73,9,Observational constraints on loop quantum cosmology
8030932536629270700,2009,66,6,Effective constraints for quantum systems
8820030516650291912,2012,62,44,Introduction to loop quantum cosmology
14179427771087077974,2009,55,10,Gravitational wave background from superinflation in loop quantum cosmology
12816380628641735356,2009,57,12,Consistent loop quantum cosmology
9285420974184856938,2011,52,11,Observational test of inflation in loop quantum cosmology
665573358847654317,2012,50,5,Deformed general relativity and effective actions from loop quantum gravity
1272593032696424274,2001,60,8,Energy distribution of a charged regular black hole
4283274688319147280,2003,38,8,The energy-momentum problem in general relativity
13008383327041334997,2002,24,8,The energy of the gamma metric in the møller prescription
9207927810400352280,2006,510,8,Quantum nature of the big bang: improved dynamics
12841375902991139449,2003,478,15,Mathematical structure of loop quantum cosmology
14178642106863534471,2003,427,22,Spin foam models for quantum gravity
9815830301515146175,2004,401,10,Black-hole entropy in loop quantum gravity
7657793161665854732,2006,384,8,Quantum nature of the big bang
10737689788590054602,2008,362,9,LQG vertex with finite Immirzi parameter
17652162772559037441,2006,340,11,Quantum nature of the big bang: an analytical and numerical investigation
9094497478749523689,2008,332,8,A new spin foam model for 4D gravity
14715409357776442328,2013,14,0,PDMS microcantilever-based flow sensor integration for lab-on-a-chip
16070466912062657717,2012,6,2,Crack-craze opening profiles near a crack tip in a polytetrafluoroethylene
10241168287159181369,2012,4,2,Experimentation  material modelling and simulation of bonded joints with a flexible adhesive
2148687474264012217,2013,4,2,Simple shear under large deformation: experimental and theoretical analyses
12590693973147692515,2013,4,4,Comparison of simple and pure shear for an incompressible isotropic hyperelastic material under large deformation
2242244679843416137,2012,2,3,Digital Fourier Transform Holography applied to investigate mechanical deformation in polymers
17748197909079003936,2012,2,0,Power-Film: Um filme flexível autónomo para alimentar dispositivos elétricos‖
10177670143440732417,2014,1,2,An approach for hyperelastic model-building and parameters estimation a review of constitutive models
5669757133117164313,2005,49,5,Variable chromosome length genetic algorithm for progressive refinement in topology optimization
5355401955967537396,2014,47,5,A survey of structural and multidisciplinary continuum topology optimization: post 2000
18216534559877821178,2010,38,7,Computational simulation of simultaneous cortical and trabecular bone change in human proximal femur during bone remodeling
3174406391089545278,2010,34,2,Reducing dimensionality in topology optimization using adaptive design variable fields
8346355660114108140,2011,33,4,Design optimization of electric vehicle battery cooling plates for thermal performance
18039946532453782719,2011,32,6,Three-dimensional micro-level computational study of Wolff's law via trabecular bone remodeling in the human proximal femur using design space topology  …
17785732172704757022,2004,27,4,Structural shape optimization considering both performance and manufacturing cost
15257344759421329425,2011,27,7,Comparison of different hip prosthesis shapes considering micro-level bone remodeling and stress-shielding criteria using three-dimensional design space topology  …
416014395657404495,2006,22,5,Evolutionary topology optimization using design space adjustment based on fixed grid
9978782857747986425,2013,20,4,Efficient generation of large-scale pareto-optimal topologies
13900259117596629787,2000,4041,34,Large N field theories  string theory and gravity
4814158270709685118,2009,901,12,Lectures on holographic methods for condensed matter physics
4185428308917783093,1999,876,12,AdS/CFT correspondence and symmetry breaking
2713151584852858860,2008,589,22,Nonlinear fluid dynamics from gravity
12170337311192273619,2001,523,10,Supersymmetric gauge theories and the AdS/CFT correspondence
11526927840178078973,2000,492,9,Linearized gravity in brane backgrounds
2407223466077859161,2013,29,10,P—V Criticality of an AdS Black Hole in f (R) Gravity
7321685401329951039,2013,13,7,Instabilities and (anti)-evaporation of Schwarzschild–de Sitter black holes in modified gravity
8100266367515834504,2014,10,13,Semiclassical geons at particle accelerators
8080914305293127348,2012,7,12,Constant curvature f (R) gravity minimally coupled with Yang–Mills field
9943571910474772480,2013,6,8,EXISTENCE OF REISSNER–NORDSTRÖM-TYPE BLACK HOLES IN f (R) GRAVITY
2941199365017252443,2013,5,10,Dynamical couplings  dynamical vacuum energy and confinement/deconfinement from R2-gravity
2971702054913280258,2013,5,7,Thermodynamic analysis of black hole solutions in gravitating nonlinear electrodynamics
17845868521743615935,2012,4,11,Black hole formation from a null fluid in extended Palatini gravity
14297867725698357995,2014,3,9,The geometry of black hole singularities
2783793103906469699,2014,1,6,The flyby anomaly and the effect of a topological torsion current
17155163233336933183,2014,2,8,Perturbation of the metric around a spherical body from a nonminimal coupling between matter and curvature
3676322590299354502,2005,47,9,On the reliability of the so-far performed tests for measuring the Lense–Thirring effect with the LAGEOS satellites
9969246986725262852,2009,44,13,Towards a one percent measurement of frame dragging by spin with satellite laser ranging to LAGEOS  LAGEOS 2 and LARES and GRACE gravity models
1078964203814053146,2002,41,9,Constraints on a Yukawa gravitational potential from laser data of LAGEOS satellites
4113733280024832107,2005,39,10,The impact of the new Earth gravity models on the measurement of the Lense–Thirring effect with a new satellite
11700456691227439323,2003,275,8,Cartan for beginners: differential geometry via moving frames and exterior differential systems
8610317082362162667,2006,241,20,Series Editors Hyman Bass Joseph Oesterlé
10793580876764916943,1990,219,5,Twistor theory for Riemannian symmetric spaces
16851245307843451632,2001,176,13,Bernstein-Gelfand-Gelfand sequences
14607848604425799742,1999,174,18,Parabolic geometries and canonical Cartan connections
9286000785134475940,2005,124,29,Higher symmetries of the Laplacian
8742103105195963870,2000,122,9,Differential invariants and curved Bernstein-Gelfand-Gelfand sequences
2152061224638827063,1999,107,48,Classification of irreducible holonomies of torsion-free affine connections
14545419399471161171,1991,81,2,Almost Hermitian symmetric manifolds. I. Local twistor theory
5210721058499727650,2000,75,11,Refined Kato inequalities and conformal weights in Riemannian geometry
7205846419830703788,2007,590,14,Disappearing cosmological constant in f (R) gravity
10599942305238779503,2009,306,12,The physics of cosmic acceleration
7772706417346628141,2007,304,17,Extra force in f (R) modified theories of gravity
4118559321823337963,2009,25,7,Hybrid stiff-string–polynomial basis functions for vibration analysis of high speed rotating beams
7517502115590846158,2011,13,25,Exact frequency analysis of a rotating cantilever beam with tip mass subjected to torsional-bending vibrations
14867370782059146149,2011,9,6,Investigation on steady state deformation and free vibration of a rotating inclined Euler beam
12422444524245261135,2013,5,2,Free vibration of a rotating tapered Rayleigh beam: a dynamic stiffness method of solution
12336552055306580091,2009,5,4,Out-of-plane free vibration analysis of rotating tapered beams in post-elastic regime
11379276499064090826,2009,4,4,Free flapping vibration of rotating inclined Euler beams
13897629724673985890,2013,3,3,Free vibration of a functionally graded rotating Timoshenko beam using FEM
13413862887924441123,2013,3,2,A virtual prototype of a constrained extensible crank mechanism: Dynamic simulation and design
4495817415205218924,2011,3,13,A corotational finite element method combined with floating frame method for large steady-state deformation and free vibration analysis of a rotating-inclined  …
12552322435501134383,2012,2,0,The Dynamics of an Extensible Link with one and two Moving Ends
7987530617241765317,2010,72,12,A Holographic view on physics out of equilibrium
2306439852200219262,2012,111,10,Cosmological solutions in bimetric gravity and their observational tests
10997034483227615975,2012,93,10,Proof of consistency of nonlinear massive gravity in the Stückelberg formulation
2026955632224982732,2012,81,9,Perturbations in massive gravity cosmology
17836064570674689730,2003,446,16,Cosmology with tachyon field as dark energy
9743074012998685793,2008,198,18,Template bank for gravitational waveforms from coalescing binary black holes: Nonspinning binaries
5836686649283743030,2010,90,22,The hunt for new physics at the Large Hadron Collider
4758114367138782133,2009,86,9,Cross section  final spin  and zoom-whirl behavior in high-energy black-hole collisions
17286090938541983279,2010,66,12,Nonaxisymmetric instability of rapidly rotating black hole in five dimensions
11899185685053455359,2010,61,12,Bar-mode instability of a rapidly spinning black hole in higher dimensions: Numerical simulation in general relativity
4351223922447540002,2010,58,43,From the LHC to future colliders
8464509980855291135,2009,48,14,Higher-dimensional numerical relativity: Formulation and code tests
3411141484872343198,2010,48,16,Numerical relativity for D dimensional space-times: Head-on collisions of black holes and gravitational wave extraction
15973768859553527913,2010,47,12,Ultraspinning instability of rotating black holes
8982171780148883724,2010,44,13,Numerical relativity for D dimensional axially symmetric space-times: formalism and code tests
8488332172485956674,2011,36,8,Hawking emission from quantum gravity black holes
10488696930190595587,2001,724,11,Supergravity description of field theories on curved manifolds and a no go theorem
6432739866891013214,2001,674,13,Towards the large N limit of pure N= 1 super Yang-Mills theory
12547072718937036570,2000,601,6,The string dual of a confining four-dimensional gauge theory
12143260931364617090,2004,456,11,Chiral symmetry breaking and pions in nonsupersymmetric gauge/gravity duals
547380206600697918,2010,265,13,Effective Holographic Theories for low-temperature condensed matter systems
14943875332645457676,2000,247,14,General properties of the self-tuning domain wall approach to the cosmological constant problem
10083508937936202121,2007,211,2,Exploring improved holographic theories for QCD: Part I
2817635560218688936,2006,204,12,Towards the string dual of N= 1 supersymmetric QCD-like theories
13261455970633090757,2000,197,9,A critical cosmological constant from millimeter extra dimensions
18332514985305030590,2007,257,22,Fluid simulation: SIGGRAPH 2007 course notes Video files associated with this course are available from the citation page
7553684908091962442,2005,225,27,Particle-based fluid-fluid interaction
3553228652832884632,2007,185,9,Smoothed particle hydrodynamics on GPUs
8191866703926819612,2005,175,13,Coupling water and smoke to thin deformable and rigid shells
14270696127658559439,2007,177,2,Weakly compressible SPH for free surface flows
2438435577790546975,2008,160,10,Two-way coupled SPH and particle level set fluid simulation
11024100621105454422,2009,154,15,Predictive-corrective incompressible SPH
687555134046988991,2007,149,16,A unified particle model for fluid–solid interactions
5203586542739910897,2005,136,14,A unified lagrangian approach to solid-fluid animation
13090282613453809053,2009,279,9,Vascular extracellular matrix and arterial mechanics
14575728227589140873,2010,173,12,Constitutive modelling of arteries
15459804941261622706,2009,102,8,Fundamental role of axial stress in compensatory adaptations by arteries
3193461583646611742,2009,92,7,Biophysical models of tumour growth
951204440752591133,2009,83,8,Origin of axial prestretch and residual stress in arteries
17091144970330599808,2012,76,10,Mechanics  mechanobiology  and modeling of human abdominal aorta and aneurysms
10503274527225052098,2010,58,10,Biohybrid thin films for measuring contractility in engineered cardiovascular muscle
14046857081033691721,2011,55,5,Blood vessel tissue prestress modeling for vascular fluid–structure interaction simulation
16914698401656494291,2010,54,10,Emergent gauge fields in holographic superconductors
12554171729657861319,2010,51,7,Gauss-Bonnet holographic superconductors
9429542468202758082,2011,45,11,The 3+ 1 holographic superconductor with Weyl corrections
17086506205989451537,2011,45,9,Holographic phase transitions of p-wave superconductors in Gauss-Bonnet gravity with backreaction
6427695090233288217,2011,41,8,Holographic superconductors in Gauss-Bonnet gravity with Born-Infeld electrodynamics
16224971893726644247,2012,36,10,Magnetic response in the holographic insulator/superconductor transition
7129962574655575661,2011,35,10,Analytical investigation of the phase transition between holographic insulator and superconductor in Gauss-Bonnet gravity
6771617474562764872,2010,32,9,Holographic superconductors and higher curvature corrections
2381613105488904047,2012,35,7,Effect of external magnetic field on holographic superconductors in presence of nonlinear corrections
6893101672069357730,2010,41,18,Extremal black holes in the Hořava–Lifshitz gravity
2987280874533036148,2010,31,11,Black hole solutions in Horava-Lifshitz Gravity with cubic terms
1230656342322713401,2011,21,9,Detailed balance condition and ultraviolet stability of scalar field in Horava-Lifshitz gravity
11110805474036170906,2010,20,10,Liouville-Lifshitz theory in 3+ 1 dimensions
14773531245605458999,2011,18,7,Particle motion around black hole in Hořava-Lifshitz gravity
2523376051958626727,2011,17,11,Strong coupling in nonrelativistic general covariant theory of gravity
14654742508508926357,2011,17,7,ASPECTS OF HOŘAVA–LIFSHITZ COSMOLOGY
5922662233960290211,2011,16,9,Black holes and global structures of spherical spacetimes in Horava-Lifshitz theory
15863860678960410730,2011,14,10,Spherically symmetric solutions in covariant Horava-Lifshitz gravity
15417148666946297320,2011,14,8,Energy extraction and particle acceleration around a rotating black hole in Hořava-Lifshitz gravity
9903885045403063296,2013,37,14,I-Love-Q: Unexpected universal relations for neutron stars and quark stars
15242393381461826803,2014,7,6,Toward realistic and practical no-hair relations for neutron stars in the nonrelativistic limit
13392169671695855426,2014,6,3,Why I-Love-Q: Explaining why universality emerges in compact objects
10398420860552745386,2014,4,6,Slowly rotating neutron and strange stars in R2 gravity
14435663814610371063,2014,3,5,Universal IQ relations for rapidly rotating neutron and strange stars in scalar-tensor theories
8458731971819209465,2014,2,3,Spectral properties of the post-merger gravitational-wave signal from binary neutron stars
10621809843984073114,2015,1,5,Unveiling the universality of I-Love-Q relations
15638408197293570222,2014,2,3,Slowly Rotating Anisotropic Neutron Stars in General Relativity and Scalar-Tensor Theory
1602002281117731599,2009,63,16,Reconstructing the distortion function for nonlocal cosmology
8210133555923231730,2009,58,11,Inflation from N-Forms and its stability
14582226153100852130,2010,46,10,Nonlocal gravity and the diffusion equation
4153641992023851466,2012,47,11,Stable bounce and inflation in non-local higher derivative cosmology
1765819912858114137,2012,40,7,De Sitter universe in nonlocal gravity
7429578492140766166,2009,36,15,One-loop effective action for non-local modified Gauss–Bonnet gravity in de Sitter space
7891604861861916954,2011,34,9,Unifying Einstein and Palatini gravities
363866439104013956,2013,34,6,Nonlocal theory of massive gravity
16112824115914909329,2011,59,7,Effects of flexibility on the aerodynamic performance of flapping wings
663097318040964401,2013,12,4,An introduction to flapping wing aerodynamics
758287886675858680,2013,9,4,Approximate aeroelastic modeling of flapping wings in hover
15747885161340316751,2011,6,2,Nonlinear Approximate Aeroelastic Analysis of Flapping Wings in Hover and Forward Flight
18374401551925516460,2013,2,4,Optimal thickness distributions of aeroelastic flapping shells
6983884693958193100,2012,1,0,Physics-Based Design of Micro Air Vehicles
8913415133023592773,2011,1,2,Aerodynamics  Scaling  and Performance of a Flexible Flapping Wing
12227602122487641909,2005,1202,11,Proximity effects in superconductor-ferromagnet heterostructures
9602059868174452094,2008,1179,15,Theory of ultracold atomic Fermi gases
11495369562210763994,2006,916,12,Pairing and phase separation in a polarized Fermi gas
6512423363401663312,2006,821,22,Fermionic superfluidity with imbalanced spin populations
17955131605339812966,2010,300,12,Spin-imbalance in a one-dimensional Fermi gas
8660643738261312260,2004,274,10,Gapless color-flavor-locked quark matter
3265346783625063975,2007,253,11,Fulde–Ferrell–Larkin–Ovchinnikov state in heavy fermion superconductors
16891213209594436867,2005,242,8,Hybrid stars that masquerade as neutron stars
4856568543914136198,2011,78,7,Static solutions with spherical symmetry in f (T) theories
16199254921104258406,2011,75,9,Non-trivial frames for f (T) theories of gravity and beyond
18008958241997607983,2013,20,6,Complete cosmic history with a dynamical Λ= Λ (H) term
16473316409737742618,2013,16,10,Entropic cosmology for a generalized black-hole entropy
14224948676834714942,2014,13,13,Minimal Higgs inflation
8788469348615037528,2014,12,7,Effective equation of state for running vacuum:'mirage'quintessence and phantom dark energy
5916483129019702309,2014,12,5,Vacuum energy and cosmological evolution
10459815631747099615,2014,10,5,Entropic-force dark energy reconsidered
17624564298794509475,2014,10,5,Inflaton as an auxiliary topological field in a QCD-like system
