id,year,citations,versions,title
17654907465350588865,2008,89,6,Traditional medicinal plants of cold desert Ladakh—used against kidney and urinary disorders
6086446135248995907,2007,87,6,Antioxidant effect of Cytisus scoparius against carbon tetrachloride treated liver injury in rats
15949690421799262249,2008,83,16,A compilation of bioactive compounds from Ayurveda
9032456261283917891,2010,80,4,Herbal drugs: Standards and regulation
3656371253932433205,2008,74,11,The Ayurvedic medicine Clitoria ternatea—from traditional use to scientific assessment
11416478911903321224,2011,58,5,Bioactive compounds from natural resources against skin aging
10157411644372133651,2007,55,6,Traditional medicinal plants of cold desert Ladakh—used in treatment of cold  cough and fever
16786038821590092501,2011,89,4,A review of meshless methods for laminated and functionally graded plates and shells
16660129296479726465,2005,51,4,Boundary methods: elements  contours  and nodes
682007039790362065,2001,48,3,The meshless standard and hypersingular boundary node methods—applications to error estimation and adaptivity in three‐dimensional problems
755200476965838678,2008,37,3,Meshless approximation combined with implicit topology description for optimization of continua
9715716406850702146,2004,37,5,Optimal shape profiles for cooling fins of high and low conductivity
96128283821006700,2005,32,4,Application of the element-free Galerkin meshless method to 3-D fracture mechanics problems
14538069373176715739,2007,29,3,CAD inspired hierarchical partition of unity constructions for NURBS‐based  meshless design  analysis and optimization
2471759710930654680,2010,95,8,Equation of state of a dense and magnetized fermion system
5523816942277223539,2013,57,13,Magnetic field-induced gluonic (inverse) catalysis and pressure (an) isotropy in QCD
16273723518333543010,2008,45,11,Magnetized strange quark matter and magnetized strange quark stars
3564177509635685632,2009,39,11,Structure and evolution of self-gravitating objects and the orthogonal splitting of the Riemann tensor
10028231685676820944,2006,36,13,The superflares of soft γ-ray repeaters: giant quakes in solid quark stars?
13630530383183427365,2007,35,9,AXPs/SGRs: Magnetars or quark-stars?
12617425472847131036,2004,32,12,Nonlinear electrodynamics and the surface redshift of pulsars
5315767284929498651,2004,29,12,Non-linear electrodynamics and the gravitational redshift of highly magnetized neutron stars
14331916670013416877,2010,190,11,Advances in heat pump systems: A review
3390503854961105396,2013,58,12,Achieving better energy-efficient air conditioning–a review of technologies and strategies
1643755407209903655,2009,30,2,Theoretical study of a novel refrigeration compressor–Part I: Design of the revolving vane (RV) compressor and its frictional losses
2487799016342655522,2009,24,5,Theoretical study of a novel refrigeration compressor-Part III: Leakage loss of the revolving vane (RV) compressor and a comparison with that of the rolling piston type
8375963477945390178,2010,24,3,Design analysis of the novel revolving vane expander in a transcritical carbon dioxide refrigeration system
15944651082126498582,2009,14,4,Experimental study of the revolving vane (RV) compressor
15227719778223435712,2009,13,0,Introduction of the revolving vane expander
6273608508940789137,2011,11,2,Analytical study of the endface friction of the revolving vane mechanism
10370421813238269059,2011,10,3,Heat transfer in compression chamber of a revolving vane (RV) compressor
15221324623740561201,2011,8,3,Study on leakage via the radial clearance in a novel synchronal rotary refrigeration compressor
5256413237754611042,2003,764,17,Brane-world gravity
6908147600227517998,2003,276,16,Cosmology and brane worlds: a review
7199520332437914300,2004,211,13,Brane world cosmology
13059138856239222120,2010,206,59, Brane-World Gravity
554599915177412091,2004,165,12,D‐branes in Standard Model building  gravity and cosmology
17620657422056108650,2006,128,6,Challenges for scaling cosmologies
5528315856423299706,2003,687,11,Braneworld models of dark energy
5784466583433619348,2005,526,32,5 Dark Matter and Dark Energy
17778198982676315646,2004,430,15,Is there supernova evidence for dark energy metamorphosis?
10116009342336570201,2008,171,20,HESS very-high-energy gamma-ray sources without identified counterparts
11173176065129045197,2011,121,12,Be/X-ray binaries
8430494879441692302,2009,96,19,A catalog of x-ray point sources from two megaseconds of Chandra observations of the Galactic Center
2347424756467364367,2009,46,7,A Model for the Waveform Behavior of Accreting Millisecond X-Ray Pulsars: Nearly Aligned Magnetic Fields and Moving Emission Regions
3580849251251606376,2010,46,14,The fourth IBIS/ISGRI soft gamma-ray survey catalog
17983285079309567591,2010,36,13,Orbital Period and Outburst Luminosity of Transient Low Mass X-ray Binaries
11277854827147025776,2011,348,12,Split states  entropy enigmas  holes and halos
3641331646416806212,2004,261,15,Building a better racetrack
15004540171039542264,2005,251,19,Exact counting of supersymmetric black hole microstates
178410530155506539,2006,155,17,The non-BPS black hole attractor equation
14414043830135156767,2005,149,21,Fixing all moduli in a simple F-theory compactification
1175865615354780541,2005,141,8,New attractors
9363572588949458903,2011,34,4,Calculation of high energy neutrino-nucleon cross sections and uncertainties using the MSTW parton distribution functions and implications for future experiments
16406875238857266470,2012,27,7,Study of LHC searches for a lepton and many jets
4806146968196976266,2011,25,12,Radiation from a D-dimensional collision of shock waves: first order perturbation theory
12428506719339287058,2011,22,9,Asymptotic safety and Kaluza-Klein gravitons at the LHC
3342671028129874193,2009,2651,8,Edmund Husserl  Logische Untersuchungen
9682619608725371374,2011,12,4,After Gödel: Platonism and rationalism in mathematics and logic
3357640040103936761,2008,4,6,Husserl on analyticity and beyond
1991571223653640272,2012,4,6,Carnap's ideal of explication and naturalism
7250132824472305979,2010,3,8,Platonism  phenomenology  and interderivability
643354835933022120,2011,4,5,Nonsense and Absurdity: Carnap's use of Husserl's Theory of Meaning
8614753924158556221,2011,2,3,Russell's Critique Of Bergson And The Divide Between 'Analytic'And 'Continental'Philosophy
10537836230536260349,2012,2,3,The Self and the Others: Common Topics for Husserl and Wittgenstein
3420654415751478432,2013,2,3,Encounters Between Analytic and Continental Philosophy
12171292348249561437,2013,1,3, Was There a Sun Before Men Existed?: AJ Ayer and French Philosophy in the fifties
3116110047630172912,2014,1,6,Bianchi Type I Cosmological Models in Eddington-inspired Born–Infeld Gravity
15929720708877806003,2014,1,5,Friedmann equations from nonequilibrium thermodynamics of the Universe: A unified formulation for modified gravity
4759897582701325843,2012,20,9,Wormholes supported by hybrid metric-Palatini gravity
8621174300647031039,2013,18,8,Bounces  turnarounds and singularities in bimetric gravity
10858821508589290969,2012,11,7,Bimetric variational principle for general relativity
5059370763315955845,2012,23,13,Shaping black holes with free fields
1533932871717852933,2010,21,10,Gauss-Bonnet black holes with nonconstant curvature horizons
2135886886374984392,2010,14,13,Einstein-Gauss-Bonnet black strings
1483021702131865121,2011,13,7,Hawking radiation of Dirac particles from black strings
15922680954253515067,2010,8,9,Magnetic black holes with higher-order curvature and gauge corrections in even dimensions
6434126994222093667,2010,8,9,Shock waves and Birkhoff's theorem in Lovelock gravity
8006948335607600223,2011,21,14,Mass action in ionic solutions
9854432336999764658,2012,14,5,Computational modeling of ion transport through nanopores
1075616943298395958,2012,7,15,Ionizable side chains at catalytic active sites of enzymes
172898731829810110,2010,50,2,A note on Friedmann equation of FRW universe in deformed Horava-Lifshitz gravity from entropic force
17769145082004722817,2005,2430,25,Formation of dense partonic matter in relativistic nucleus–nucleus collisions at RHIC: Experimental evaluation by the PHENIX Collaboration
3354774865019352754,2006,519,10,Hadron production in central nucleus–nucleus collisions at chemical freeze-out
6402800745950983880,2007,439,9,Phases of dense quarks at large Nc
4244457829696814209,2005,433,17,Thermodynamics of two flavor QCD to sixth order in quark chemical potential
16047182985194279333,2005,429,16,Collective flow signals the quark–gluon plasma
4720755545466455720,2005,257,15,Phase diagram of neutral quark matter: Self-consistent treatment of quark masses
14868975567692566615,2009,418,13,Spectral dimension of the universe in quantum gravity at a Lifshitz point
12401234369681559156,2005,280,14,The spectral dimension of the universe is scale dependent
17127937730856270924,2006,155,13,Fixed points of higher-derivative gravity
5462667441285857465,2011,123,13,Colored group field theory
15092398661999766102,2006,119,14,The universe from scratch
4577502041002837665,2013,17,7,Gauss-Bonnet dark energy by Lagrange multipliers
9186448323557883933,2013,15,10,Cosmic history of viable exponential gravity: Equation of state oscillations and growth index from inflation to dark energy era
1946409039074338475,2013,15,6,Noether symmetries and analytical solutions in f (T) cosmology: A complete study
138793522409662892,2012,14,7,Generation of large-scale magnetic fields from inflation in teleparallelism
18376725346722182156,2012,13,8,Generalized Noether symmetry in f (T) gravity
1956594048232184573,2013,11,7,Conditional symmetries and the canonical quantization of constrained minisuperspace actions: The Schwarzschild case
15060661528937322230,2014,10,6,Scalar-tensor gravity cosmology: Noether symmetries and analytical solutions
2468291175971151853,2012,8,16,Periodic cosmological evolutions of equation of state for dark energy
1585922192124760888,2011,50,9,Bumpy black holes in alternative theories of gravity
6225665168812380313,2011,45,10,Nonspinning black holes in alternative theories of gravity
1961776686396729416,2011,36,6,Compact stars in alternative theories of gravity: Einstein-Dilaton-Gauss-Bonnet gravity
1389352719468141499,2011,7285,40,Seven-year Wilkinson microwave anisotropy probe (WMAP) observations: cosmological interpretation
11748878295202277405,2003,4554,32,The microwave anisotropy probe mission
626756955173747951,2004,3127,16,Cosmological parameters from SDSS and WMAP
12994979933012042591,2014,2602,16,Planck 2013 results. XVI. Cosmological parameters
10932845368792441573,2005,1741,12,Viscosity in strongly interacting quantum field theories from black hole physics
2175356245767159368,2005,100,30,A survey of structural optimization in mechanical product development
1624409647988400625,2013,23,4,Shape optimization of continua using NURBS as basis functions
8121006888235923358,2010,14,5,A level set based topology optimization method using the discretized signed distance function as the design variables
5439029984481099237,2008,12,3,Application of topology  size and shape optimization methods in polymer metal hybrid structural lightweight engineering
12451626058465200304,2009,8,4,Shape optimization of 3D viscous flow fields
17003627388885907662,2001,1126,13,Macroscopic strings as heavy quarks: Large-N gauge theory and anti-de Sitter supergravity
4281357102954181894,2002,373,15,Holographic renormalization
4595241237511853061,2002,319,12,Mass  entropy  and holography in asymptotically de Sitter spaces
4359353606014215622,2011,19,10,Hamiltonian formulation of Palatini f (R) theories à la Brans-Dicke theory
16398213897380714766,2010,85,10,A global spectral study of black hole X-ray binaries
14353279143399968168,2010,75,11,Episodic transient gamma-ray emission from the microquasar Cygnus X-1
5023012846772908627,2010,64,13,Evidence for a compact jet dominating the broad-band spectrum of the black hole accretor XTE J1550–564
10463339199670442239,2011,56,13,X-ray variability and hardness of ESO 243-49 HLX-1: Clear evidence for spectral state transitions
18425837150553408007,2011,51,15,The Faint
15248053487176477069,2011,50,9,Black hole transients
10504871717739464489,2013,48,7,Observational constraints on the powering mechanism of transient relativistic jets
216559714308337344,2011,74,17,Holography for Schrödinger backgrounds
11809361883904973287,2008,68,11,Consistent boundary conditions for cosmological topologically massive gravity at the chiral point
3231387902377752331,2010,65,14,AdS 3/LCFT 2–Correlators in new massive gravity
11482262653476415822,2009,123,11,Fractional quantum Hall effect via holography: Chern-Simons  edge states and hierarchy
10687133689891929468,2010,119,7,Holographic evolution of entanglement entropy
2145620708980830050,2012,118,7,Entanglement renormalization and holography
4340458357222703326,2004,239,10,Phantom Field and the Fate of the Universe
12176668796633712812,2005,213,15,Dark energy: the cosmological challenge of the millennium
589023416574037887,2007,95,10,Gauss–Bonnet cosmologies: crossing the phantom divide and the transition from matter dominance to dark energy
10827622953304413813,2004,87,9,Nonminimal coupling  exponential potentials and the w<-1 regime of dark energy
17155737379301598146,2005,71,11,Inflation from superstring and M-theory compactification with higher order corrections
5080103482626755553,2006,69,9,On compatibility of string effective action with an accelerating universe
1828698744365304157,1997,344,7,Axiomatic approach to electromagnetic and gravitational radiation reaction of particles in curved spacetime
11026894897595777566,2003,214,8,Self-force via a Green's function decomposition
11112588140970666739,2011,169,60, The Motion of Point Particles in Curved Spacetime
5080165055842175280,2000,164,9,Evolution of circular  nonequatorial orbits of Kerr black holes due to gravitational-wave emission
117400855537007559,2000,154,8,Mode sum regularization approach for the self-force in black hole spacetime
8821563691372974599,2003,140,6,Perturbative approach to an orbital evolution around a supermassive black hole
12000832980747681991,2002,136,13,Calculating the gravitational self-force in Schwarzschild spacetime
12143564752884892741,2010,22,11,A kinematical approach to conformal cosmology
2482030412236368453,2013,2,10,Conformal Gravity and the Alcubierre Warp Drive Metric
10936522135728137312,2011,412,15,The Atacama cosmology telescope: cosmological parameters from the 2008 power spectrum
6163951124495608478,2009,196,11,Electrodynamics with Lorentz-violating operators of arbitrary dimension
14450578516389742121,2010,181,12,Hunting for primordial non-Gaussianity in the cosmic microwave background
15161128252883936848,2013,166,10,A Measurement of the Cosmic Microwave Background Damping Tail from the 2500-square-degree SPT-SZ survey
13980523143049738436,2009,159,10,Inflationary universe with anisotropic hair
8161269260648852753,2009,140,7,Advances in inflation in string theory
7559713198845096912,2011,118,11,Cosmological and astrophysical neutrino mass measurements
4176008789723598944,2011,109,12,Resonant non-gaussianity
9639864858025191225,2010,142,20,Switched magnetospheric regulation of pulsar spin-down
362898861813754456,2009,138,26,Fermi Large Area Telescope Observations of the Vela Pulsar
13231190525423643019,2013,9,6,Quantitative imaging of the electrostatic field and potential generated by a transmembrane protein pore at subnanometer resolution
13907616086370794027,2013,8,4,ATP Transport through VDAC and the VDAC–Tubulin Complex Probed by Equilibrium and Nonequilibrium MD Simulations
7390834156239807259,2014,6,4,Modelling three-dimensional protein structures for applications in drug design
11666460152290512444,2014,4,5,Tuning ion transport and selectivity by a salt gradient in a charged nanopore
4630532007733925925,2014,5,9,Time-dependent density functional theory for ion diffusion in electrochemical systems
7041897499526687909,2013,3,4,Role of the Central Arginine R133 toward the Ion Selectivity of the Phosphate Specific Channel OprP: Effects of Charge and Solvation
4283017917062856256,2014,3,5,A stabilized finite element method for modified Poisson-Nernst-Planck equations to determine ion flow through a nanopore
8273566570504371979,2013,3,4,Controlling polymerization initiator concentration in mesoporous silica thin films
1550217082753348579,2013,2,7,Disentangling steric and electrostatic factors in nanoscale transport through confined space
11540126313308913878,2014,2,3,Effect of confinement on DNA  solvent and counterion dynamics in a model biological nanopore
10951528409705612493,2009,523,13,Optics and interferometry with atoms and molecules
1247478978424190041,1999,444,32,Experiment and the foundations of quantum physics
16528737716525939245,2002,285,19,Matter-wave interferometer for large molecules
15197659253861629366,2003,213,13,Violation of a Bell-like inequality in single-neutron interferometry
7205235341405440663,2006,212,11,Neutron and x-ray diffraction studies of liquids and glasses
16716572843916641718,2003,191,19,Measurement of quantum states of neutrons in the Earth's gravitational field
16414170909524599904,1995,166,6,Noncollinear and collinear magnetic structures in exchange coupled Fe/Cr (001) superlattices
1030771291096721705,2008,163,3,The neutron. Its properties and basic interactions
13082754945931889110,2011,148,11,Quantum interference of large organic molecules
13409090410593903548,1987,141,10,Stochastic and deterministic absorption in neutron-interference experiments
8202278525223827695,2004,604,8,Chiral effective model with the Polyakov loop
8558596659562099542,2002,566,13,The QCD phase diagram for small densities from imaginary chemical potential
10511058040344109879,2002,564,13,QCD thermal phase transition in the presence of a small chemical potential
17774211964253430282,2003,541,12,Hydrodynamic description of ultrarelativistic heavy-ion collisions
6532185922484882976,2003,453,12,Finite density QCD via an imaginary chemical potential
7735486208423331357,2004,262,22,A survey of point-based techniques in computer graphics
8817180146462667216,2005,195,21,Particle-based viscoelastic fluid simulation
11482075726885338484,2006,168,19,Fluid animation with dynamic meshes
11519281073597369609,2010,25,6,Design optimization of a mechanical heart valve for reducing valve thrombogenicity—a case study with ATS valve
526510054878197749,2010,24,19,Simulation of the three-dimensional hinge flow fields of a bileaflet mechanical heart valve under aortic conditions
15174610582850396829,2010,15,16,Numerical investigation of the performance of three hinge designs of bileaflet mechanical heart valves
14309692473455739614,2009,8,4,Impact of design parameters on bi-leaflet mechanical heart valve flow dynamics
15118389553848347245,2009,5,5,Flow dynamic comparison between recessed hinge and open pivot bi-leaflet heart valve designs
10793680765249245513,2012,5,7,Evaluation of shear stress accumulation on blood components in normal and dysfunctional bileaflet mechanical heart valves using smoothed particle hydrodynamics
7677059877620070136,2010,3,7,Prosthetic heart valves: Difficult to make something simple
1930667592369360055,2011,279,33,Design concepts for the Cherenkov Telescope Array CTA: an advanced facility for ground-based high-energy gamma-ray astronomy
12521096061065860090,2009,261,30,On possible interpretations of the high energy electron–positron spectrum measured by the Fermi Large Area Telescope
10127739002694287590,2009,255,11,TeV gamma rays from Geminga and the origin of the GeV positron excess
15810782976355773093,2008,160,2,The Crab nebula: an astrophysical chimera
12226994743139312318,2009,150,14,Pulsars versus dark matter interpretation of ATIC/PAMELA
17340633047737784502,2010,58,9,“Kerrr” black hole: The lord of the string
17988726717922479,2005,506,58,Modern tests of Lorentz invariance
1136726893233718206,2008,125,11,Constraints on torsion from bounds on Lorentz violation
13762361554442465620,2006,111,3,Einstein-Cartan theory
11189012792828328652,2007,60,7,The Einstein–Cartan–Elko system
2747199096571116078,2010,57,20,Searches for the role of spin and polarization in gravity
14388732689081492012,2007,52,11,Constraining torsion with gravity probe B
12813551898042273623,2008,53,10,Dark spinors with torsion in cosmology
16404743003393287996,2006,169,12,f (R) gravity and scalar–tensor theory
6859100714935791566,2005,167,11,Stability of modified gravity models
8459497205955867813,2006,165,8,Solar system experiments do not yet veto modified gravity models
4172256313444297997,2009,114,10,Holographic hydrodynamics with a chemical potential
9851708637164437661,2012,98,11,From Navier-Stokes To Einstein
5761994740183527027,2008,95,11,Shear viscosity from effective couplings of gravitons
13246169771421942536,2009,87,11,Shear viscosity from Gauss-Bonnet gravity with a dilaton coupling
10897162266597386623,2010,80,13,AdS 7/CFT 6  Gauss-Bonnet gravity  and viscosity bound
4764758567805572945,2008,170,9,Observational tests of modified gravity
12094640772856637182,2010,60,15,Prediction of narrow N* and Λ* resonances with hidden charm above 4 GeV
14883915362821008297,2010,57,10,Boer-Mulders effect in unpolarized SIDIS: An analysis of the COMPASS and HERMES data on the cos⁡ 2 ϕ asymmetry
17762205405156653071,2009,43,10,Exotic nuclei with open heavy flavor mesons
6797143472564102411,2012,41,13,Charmed and strange baryon resonances with heavy-quark spin symmetry
15931376268586894370,2009,39,12,Implications of Heavy-Quark Spin Symmetry on Heavy-Meson Hadronic Molecules
11636162374109930820,2011,39,5,Future prospects for hadron physics at P¯ ANDA
12176893926692684725,2010,36,12,Novel analysis of the decays ψ′→ hc π 0 and η c′→ χ c 0 π 0
4236746354980359469,2009,34,10,Meson masses and decay constants from unquenched lattice QCD
10413990765289153669,2013,38,17,Wormholes in a viable f (T) gravity
14809049653490802809,2013,32,7,Charged black hole with a scalar hair in (2+ 1) dimensions
1587093286149645806,2013,28,13,Energy conditions in generalized teleparallel gravity models
145673977593811629,2008,138,17,Where post-Newtonian and numerical-relativity waveforms meet
16786800964665820420,2009,130,15,Effective-one-body waveforms calibrated to numerical relativity simulations: Coalescence of nonspinning  equal-mass black holes
77073776509928240,2009,128,9,Improved analytical description of inspiralling and coalescing black-hole binaries
3181114043584255102,2011,55,10,New types of f (T) gravity
12435064172597075365,2004,790,8,Chameleon cosmology
16512669190965883812,2002,665,27,Modified Newtonian dynamics as an alternative to dark matter
13585995601165790652,2006,583,9,Flux compactifications in string theory: A comprehensive review
2426532034284168609,2003,532,13,1/R gravity and scalar-tensor gravity
18386209665520530330,2012,20,6,Empathy and mirroring: Husserl and Gallese
11723804285026401341,2013,14,5,Emotions and personhood: Exploring fragility-making sense of vulnerability
14096856113098293605,2011,10,4,Shall we tango? No  but thanks for asking
15104582985370844985,2011,5,4,The dorsal stream and the visual horizon
6222852318974592030,2011,9,5,Das Leibgedächtnis. Ein Beitrag aus der Phänomenologie Husserls
6626108331840864105,2012,4,6,Intentionality and presence: on the intrinsic of-ness of consciousness from a transcendental-phenomenological perspective
3837930979407932295,2014,6,3,Self and Other: Exploring Subjectivity  Empathy  and Shame
5599534485405695765,2012,3,6,Educational Neuroscience: Neuroethical Considerations.
930630862236653332,2013,3,3,Neurophenomenology and its applications to psychology
4822517914624988435,2014,2,11,RDoC+: taking translation seriously
6688726604362883817,2011,73,8,Holographic gravitational anomaly and chiral vortical effect
1951044291761942190,2011,70,13,Fluid-gravity model for the chiral magnetic effect
17803674831993129358,2011,73,12,Chiral magnetic wave at finite baryon density and the electric quadrupole moment of the quark-gluon plasma
5655472204865250556,2011,64,11,Anomalies and time reversal invariance in relativistic hydrodynamics: the second order and higher dimensional formulations
13400262701986191368,2012,52,8,Anomaly/transport in an ideal Weyl gas
2590995962204938850,2012,52,6,Triangle anomalies  thermodynamics  and hydrodynamics
15134123616975709318,2012,51,8,Lectures on hydrodynamic fluctuations in relativistic theories
12331806577731362346,2012,51,8,Parity-violating hydrodynamics in 2+ 1 dimensions
5866183194695010260,2005,79,8,Spacetime structure of static solutions in Gauss-Bonnet gravity: Neutral case
7396335039464911854,2006,56,9,Final fate of spherically symmetric gravitational collapse of a dust cloud in Einstein-Gauss-Bonnet gravity
8269140337255899583,2006,51,8,N= 2 Liouville theory with boundary
11454504150900847956,2009,48,5,The Veneziano Limit of N= 2 Superconformal QCD: Towards the String Dual of N= 2 SU (N_c) SYM with N_f= 2 N_c
15358753879175975773,2006,34,15,D-branes in non-critical superstrings and duality in Script N= 1 gauge theories with flavor
7621284506907481781,2014,310,8,Cavity optomechanics
324779374887958737,2012,116,12,High-fidelity quantum driving
7814684969108885092,2012,85,16,Subkelvin parametric feedback cooling of a laser-trapped nanoparticle
4073004577840526033,2011,80,11,Dynamic manipulation of nanomechanical resonators in the high-amplitude regime and non-volatile mechanical memory operation
9282849092558448683,2013,54,12,Strong spin-phonon coupling between a single-molecule magnet and a carbon nanotube nanoelectromechanical system
3673155374797039351,2012,35,14,Femtogram doubly clamped nanomechanical resonators embedded in a high-Q two-dimensional photonic crystal nanocavity
