Cites,Authors,Title,Year,Source,Publisher,ArticleURL,CitesURL,GSRank,QueryDate,Type
58,"ME Ebsworth, CW Schweers","What Researchers Say and Practitioners Do. Perspectives on Conscious Grammar Instruction in the ESL Classroom.",1997,"Applied language learning","ERIC","http://eric.ed.gov/?id=EJ567519","http://scholar.google.com/scholar?cites=17531989141611223441&as_sdt=5,33&sciodt=0,33&hl=en&num=20",475,"2014-11-20",""
43,"TL Einstein","Physical structure of solid surfaces",1996,"Handbook of surface science","Elsevier: Amsterdam and New York","","http://scholar.google.com/scholar?cites=15367543030864577659&as_sdt=5,33&sciodt=0,33&hl=en&num=20",476,"2014-11-20","CITATION"
273,"A Einstein","Über Gravitationswellen",1918,"… Akademie der Wissenschaften (Berlin), Seite 154- …","adsabs.harvard.edu","","http://scholar.google.com/scholar?cites=11455417399164187138&as_sdt=5,33&sciodt=0,33&hl=en&num=20",477,"2014-11-20","CITATION"
42,"A Einstein","Investigations on the Theory of Brownian Motion, reprint of the 1st English edition (1926)",1956,"","Dover, New-York","","http://scholar.google.com/scholar?cites=18131865006120370653&as_sdt=5,33&sciodt=0,33&hl=en&num=20",478,"2014-11-20","CITATION"
42,"RD Patten, MJ Aronovitz, M Einstein, M Lambert…","Effects of angiotensin II receptor blockade versus angiotensin-converting-enzyme inhibition on ventricular remodelling following myocardial infarction in the mouse",2003,"Clinical Science","clinsci.org","http://www.clinsci.org/cs/104/cs1040109.htm","http://scholar.google.com/scholar?cites=11246401225335299842&as_sdt=5,33&sciodt=0,33&hl=en&num=20",479,"2014-11-20",""
42,"A Reiser, A Einstein","Albert Einstein: a biographical portrait",1931,"","Taylor & Francis","","http://scholar.google.com/scholar?cites=510823885997261938&as_sdt=5,33&sciodt=0,33&hl=en&num=20",480,"2014-11-20","CITATION"
43,"A Einstein","Planck's theory of radiation and the theory of specific heat",1907,"Ann. Phys","","","http://scholar.google.com/scholar?cites=8690083910184494403&as_sdt=5,33&sciodt=0,33&hl=en&num=20",481,"2014-11-20","CITATION"
43,"A Einstein, PA Schilpp","Albert Einstein: philosopher scientist",1951,"","Tudor publishing company","","http://scholar.google.com/scholar?cites=9370285286267615870&as_sdt=5,33&sciodt=0,33&hl=en&num=20",482,"2014-11-20","CITATION"
44,"O Einstein, O Ben‐Menachem‐Tzidon, R Mizrachi‐Kol…","Survival of neural precursor cells in growth factor‐poor environment: Implications for transplantation in chronic disease",2006,"Glia","Wiley Online Library","http://onlinelibrary.wiley.com/doi/10.1002/glia.20305/full","http://scholar.google.com/scholar?cites=3953878885096994102&as_sdt=5,33&sciodt=0,33&hl=en&num=20",483,"2014-11-20",""
49,"…, KK Desai, I Chaudhary, B Wong, M Einstein…","Intravenous administration of Reolysin®, a live replication competent RNA virus is safe in patients with advanced solid tumors",2010,"Investigational new …","Springer","http://link.springer.com/article/10.1007/s10637-009-9279-8","http://scholar.google.com/scholar?cites=17145099585471888105&as_sdt=5,33&sciodt=0,33&hl=en&num=20",484,"2014-11-20",""
45,"JJ Trambert, MH Einstein, E Banks, A Frost…","Uterine artery embolization in the management of vaginal bleeding from cervical pregnancy: a case series.",2005,"The Journal of …","europepmc.org","http://europepmc.org/abstract/MED/16419633","http://scholar.google.com/scholar?cites=10224623024928608369&as_sdt=5,33&sciodt=0,33&hl=en&num=20",485,"2014-11-20",""
44,"HA Einstein, N Chien","Similarity of distorted river models with movable beds",1956,"Transactions of the American Society of Civil …","cedb.asce.org","","http://scholar.google.com/scholar?cites=2936767643958097759&as_sdt=5,33&sciodt=0,33&hl=en&num=20",486,"2014-11-20","CITATION"
43,"A Einstein","The Theory of Opalescence of Homogeneous Liquids and Liquid Mixtures Near the Critical State",1993,"","","","http://scholar.google.com/scholar?cites=3288371973979977823&as_sdt=5,33&sciodt=0,33&hl=en&num=20",487,"2014-11-20","CITATION"
43,"…, M Jordan, A Tangthongkum, FWB Einstein…","X [double bond, length half m-dash] Y–ZH systems as potential 1, 3-dipoles. Part 2. Oxime cycloadditions: formation of 2: 1 adducts",1984,"Journal of the …","pubs.rsc.org","http://pubs.rsc.org/en/content/articlehtml/1984/p1/p19840000047","http://scholar.google.com/scholar?cites=10876203008053634781&as_sdt=5,33&sciodt=0,33&hl=en&num=20",488,"2014-11-20",""
42,"E Cartan, A Einstein, R Debever","Elie Cartan-Albert Einstein: Letters on Absolute Parallelism, 1929-1932",1979,"","Princeton University Press","","http://scholar.google.com/scholar?cites=10458418432096338362&as_sdt=5,33&sciodt=0,33&hl=en&num=20",489,"2014-11-20","CITATION"
47,"A Einstein","Time, space, and gravitation",1919,"On a Heuristic Point of View about the Creation …","upload.wikimedia.org","","http://scholar.google.com/scholar?cites=15721850436825622411&as_sdt=5,33&sciodt=0,33&hl=en&num=20",490,"2014-11-20","PDF"
41,"…, ML Hammond, JM Balkovec, M Einstein…","Novel heterocyclic glucocorticoids: in vitro profile and in vivo efficacy",2005,"Bioorganic & medicinal …","Elsevier","http://www.sciencedirect.com/science/article/pii/S0960894X05001770","http://scholar.google.com/scholar?cites=7196082047340299863&as_sdt=5,33&sciodt=0,33&hl=en&num=20",491,"2014-11-20",""
42,"A Einstein, N Rosen","Two-body problem in general relativity theory",1936,"Physical Review","APS","http://link.aps.org/doi/10.1103/PhysRev.49.404.2","http://scholar.google.com/scholar?cites=11357327929067446173&as_sdt=5,33&sciodt=0,33&hl=en&num=20",492,"2014-11-20",""
41,"AD Bond, BW McClelland, JR Einstein…","Ascorbic acid-2-sulfate of the brine shrimp,< i> Artemia salina</i>",1972,"Archives of biochemistry …","Elsevier","http://www.sciencedirect.com/science/article/pii/0003986172904389","http://scholar.google.com/scholar?cites=11241697445991250868&as_sdt=5,33&sciodt=0,33&hl=en&num=20",493,"2014-11-20",""
44,"HH Einstein","Tunnelling in difficult ground—swelling behaviour and identification of swelling rocks",1996,"Rock mechanics and rock engineering","Springer","http://link.springer.com/article/10.1007/BF01032649","http://scholar.google.com/scholar?cites=7036674398844921535&as_sdt=5,33&sciodt=0,33&hl=en&num=20",494,"2014-11-20",""
56,"MH Einstein, RR Barakat, DS Chi…","Management of uterine malignancy found incidentally after supracervical hysterectomy or uterine morcellation for presumed benign disease",2008,"International Journal …","Wiley Online Library","http://onlinelibrary.wiley.com/doi/10.1111/j.1525-1438.2007.01126.x/full","http://scholar.google.com/scholar?cites=8619766582965563971&as_sdt=5,33&sciodt=0,33&hl=en&num=20",495,"2014-11-20",""
41,"…, CT Boylen, HE Einstein…","Asbestos disease in family contacts of shipyard workers.",1985,"… journal of public …","ajph.aphapublications.org","http://ajph.aphapublications.org/doi/abs/10.2105/AJPH.75.6.615","http://scholar.google.com/scholar?cites=6653175606875287297&as_sdt=5,33&sciodt=0,33&hl=en&num=20",496,"2014-11-20",""
43,"DA Einstein, RG Menzies","Role of magical thinking in obsessive–compulsive symptoms in an undergraduate sample",2004,"Depression and anxiety","Wiley Online Library","http://onlinelibrary.wiley.com/doi/10.1002/da.20005/abstract","http://scholar.google.com/scholar?cites=3980336819964381153&as_sdt=5,33&sciodt=0,33&hl=en&num=20",497,"2014-11-20",""
256,"A Einstein","Quanten‐mechanik und wirklichkeit",1948,"Dialectica","Wiley Online Library","http://onlinelibrary.wiley.com/doi/10.1111/j.1746-8361.1948.tb00704.x/abstract","http://scholar.google.com/scholar?cites=2448140834032799264&as_sdt=5,33&sciodt=0,33&hl=en&num=20",498,"2014-11-20",""
252,"A Einstein","Über die Entwicklung unserer Anschauungen über das Wesen und die Konstitution der Strahlung",1969,"Physikalische Blätter","Wiley Online Library","http://onlinelibrary.wiley.com/doi/10.1002/phbl.19690250902/abstract","http://scholar.google.com/scholar?cites=7994973002589505276&as_sdt=5,33&sciodt=0,33&hl=en&num=20",499,"2014-11-20",""
41,"DS Brown, FWB Einstein, DG Tuck","Tetragonal-pyramidal indium (III) species. Crystal structure of tetraethylammonium pentachloroindate (III)",1969,"Inorganic Chemistry","ACS Publications","http://pubs.acs.org/doi/abs/10.1021/ic50071a004","http://scholar.google.com/scholar?cites=9433847087107202467&as_sdt=5,33&sciodt=0,33&hl=en&num=20",500,"2014-11-20",""
41,"RJ Batchelor, FWB Einstein, ID Gay, JH Gu…","The syntheses,< sup> 77</sup> Se CP-MAS solid state NMR spectra and crystal structures of adducts of the selenium coronand, 1, 5, 9, 13- …",1991,"Journal of organometallic …","Elsevier","http://www.sciencedirect.com/science/article/pii/0022328X9186014H","http://scholar.google.com/scholar?cites=12288306543741826404&as_sdt=5,33&sciodt=0,33&hl=en&num=20",501,"2014-11-20",""
40,"…, T Fog, K Hyllested, E Einstein","Immune response of lymphocytes from patients with multiple sclerosis to phytohemagglutinin, basic protein of myelin and measles antigens",1974,"Acta neurologica …","Wiley Online Library","http://onlinelibrary.wiley.com/doi/10.1111/j.1600-0404.1974.tb02786.x/abstract","http://scholar.google.com/scholar?cites=3267516763114858270&as_sdt=5,33&sciodt=0,33&hl=en&num=20",502,"2014-11-20",""
42,"JF Dropinski, T Akiyama, M Einstein…","Synthesis and biological activities of novel aryl indole-2-carboxylic acid analogs as PPARγ partial agonists",2005,"Bioorganic & medicinal …","Elsevier","http://www.sciencedirect.com/science/article/pii/S0960894X0500990X","http://scholar.google.com/scholar?cites=1694149713156328894&as_sdt=5,33&sciodt=0,33&hl=en&num=20",503,"2014-11-20",""
48,"A Einstein","Cosmic religion: With other opinions and aphorisms",1931,"","Covici-Friede","","http://scholar.google.com/scholar?cites=13614321659851082975&as_sdt=5,33&sciodt=0,33&hl=en&num=20",504,"2014-11-20","CITATION"
250,"A Einstein","Näherungsweise integration der feldgleichungen der gravitation",1916,"… Akademie der Wissenschaften (Berlin), Seite 688- …","adsabs.harvard.edu","","http://scholar.google.com/scholar?cites=9166010983710725525&as_sdt=5,33&sciodt=0,33&hl=en&num=20",505,"2014-11-20","CITATION"
40,"…, PSW Lee, MG Dominguez, DB Einstein…","A heteromorphic protein-tyrosine phosphatase, PTPϕ, is regulated by CSF-1 in macrophages",1995,"Journal of Biological …","ASBMB","http://www.jbc.org/content/270/45/27339.short","http://scholar.google.com/scholar?cites=4614987093731388546&as_sdt=5,33&sciodt=0,33&hl=en&num=20",506,"2014-11-20",""
40,"FWB Einstein, BR Penfold","The crystal structure of a compound containing tin (IV) in both 5-fold and 6-fold co-ordination:[(CH 3) 2 SnCl, terpyridyl]+[(CH 3) 2 SnCl 3]–",1968,"Journal of the Chemical Society A: …","pubs.rsc.org","http://pubs.rsc.org/EN/content/articlehtml/1968/j1/j19680003019","http://scholar.google.com/scholar?cites=13920295459488062612&as_sdt=5,33&sciodt=0,33&hl=en&num=20",507,"2014-11-20",""
42,"M Einstein, TE Akiyama, GA Castriota, CF Wang…","The differential interactions of peroxisome proliferator-activated receptor γ ligands with Tyr473 is a physical basis for their unique biological activities",2008,"Molecular …","ASPET","http://molpharm.aspetjournals.org/content/73/1/62.short","http://scholar.google.com/scholar?cites=16819951664504411447&as_sdt=5,33&sciodt=0,33&hl=en&num=20",508,"2014-11-20",""
39,"A Einstein","Sobranie nauchnykh trudov",1967,"","Nauka","","http://scholar.google.com/scholar?cites=12677245582328289607&as_sdt=5,33&sciodt=0,33&hl=en&num=20",509,"2014-11-20","CITATION"
39,"HA Einstein, RB Krone","Estuarial sediment transport patterns",1961,"J Hydraul Eng Div ASCE","","","http://scholar.google.com/scholar?cites=8669620866620244755&as_sdt=5,33&sciodt=0,33&hl=en&num=20",510,"2014-11-20","CITATION"
40,"RP Rago, A Einstein Jr, R Lush, TM Beer, YJ Ko…","Safety and efficacy of the MDR inhibitor Incel (biricodar, VX-710) in combination with mitoxantrone and prednisone in hormone-refractory prostate cancer",2003,"Cancer chemotherapy …","Springer","http://link.springer.com/article/10.1007/s00280-003-0573-4","http://scholar.google.com/scholar?cites=7449067386655268847&as_sdt=5,33&sciodt=0,33&hl=en&num=20",511,"2014-11-20",""
48,"…, LJ Cobb, S Fishman, T Budagov, L Cui, FH Einstein…","Humanin: a novel central regulator of peripheral insulin action",2009,"PloS one","dx.plos.org","","http://scholar.google.com/scholar?cites=936334812473111325&as_sdt=5,33&sciodt=0,33&hl=en&num=20",512,"2014-11-20","HTML"
40,"JH Humphreys, WO Einstein","Leadership and temperament congruence: Extending the expectancy model of work motivation",2004,"Journal of Leadership & …","jlo.sagepub.com","http://jlo.sagepub.com/content/10/4/58.short","http://scholar.google.com/scholar?cites=7214624298177919724&as_sdt=5,33&sciodt=0,33&hl=en&num=20",513,"2014-11-20",""
40,"…, T Weimar, UC Kreis, RJ Batchelor, FWB Einstein…","Synthesis of sulfur analogues of methyl and allyl kojibiosides and methyl isomaltoside and conformational analysis of the kojibiosides",1994,"Tetrahedron: …","Elsevier","http://www.sciencedirect.com/science/article/pii/S0957416600803869","http://scholar.google.com/scholar?cites=11511253369108334448&as_sdt=5,33&sciodt=0,33&hl=en&num=20",514,"2014-11-20",""
39,"VJ Johnston, FWB Einstein, RK Pomeroy","The new binary carbonyl tetraosmium tetradecacarbonyl: an example of carbonyl exchange on the infrared time scale",1988,"Organometallics","ACS Publications","http://pubs.acs.org/doi/abs/10.1021/om00098a028","http://scholar.google.com/scholar?cites=5622013314022292472&as_sdt=5,33&sciodt=0,33&hl=en&num=20",515,"2014-11-20",""
39,"CF Barrientos-Penna, FWB Einstein, T Jones…","Aryldiazenido, aryldiazene, and arylhydrazido complexes: derivatives of dicarbonyl (. eta. 5-cyclopentadienyl) rhenium and the x-ray structure of [(. eta. 5-C5H5) Re ( …",1982,"Inorganic …","ACS Publications","http://pubs.acs.org/doi/abs/10.1021/ic00137a010","http://scholar.google.com/scholar?cites=6033890713422211430&as_sdt=5,33&sciodt=0,33&hl=en&num=20",516,"2014-11-20",""
38,"KH Kilburn, RH Warshaw, K Einstein…","Airway disease in non-smoking asbestos workers",1985,"… Health: An International …","Taylor & Francis","http://www.tandfonline.com/doi/abs/10.1080/00039896.1985.10545935","http://scholar.google.com/scholar?cites=507709089922226481&as_sdt=5,33&sciodt=0,33&hl=en&num=20",517,"2014-11-20",""
38,"A Einstein","Essays in physics",1950,"","Philosophical Library","","http://scholar.google.com/scholar?cites=7783967740531761964&as_sdt=5,33&sciodt=0,33&hl=en&num=20",518,"2014-11-20","CITATION"
39,"A Einstein","Quantum mechanics and reality",1948,"Dialectica","","","http://scholar.google.com/scholar?cites=15295276341804006661&as_sdt=5,33&sciodt=0,33&hl=en&num=20",519,"2014-11-20","CITATION"
39,"L Einstein","Divided loyalties",1933,"","Cobden-Sanderson","","http://scholar.google.com/scholar?cites=14045808452135000126&as_sdt=5,33&sciodt=0,33&hl=en&num=20",520,"2014-11-20","CITATION"
39,"AH Goodman, R Einstein, HJ Granger","Effect of changing metabolic rate on local blood flow control in the canine hindlimb.",1978,"Circulation research","Am Heart Assoc","http://circres.ahajournals.org/content/43/5/769.short","http://scholar.google.com/scholar?cites=4420777933777014694&as_sdt=5,33&sciodt=0,33&hl=en&num=20",521,"2014-11-20",""
38,"CH Wei, C Koh, P Pfuderer, JR Einstein","Purification, properties, and crystallographic data for a principal nontoxic lectin from seeds of Abrus precatorius.",1975,"Journal of Biological Chemistry","ASBMB","http://www.jbc.org/content/250/12/4790.short","http://scholar.google.com/scholar?cites=12391018847487730735&as_sdt=5,33&sciodt=0,33&hl=en&num=20",522,"2014-11-20",""
38,"WU Shipley, LJ Coombs, AB Einstein Jr…","Cisplatin and full dose irradiation for patients with invasive bladder carcinoma: a preliminary report of tolerance and local response.",1984,"The Journal of …","europepmc.org","http://europepmc.org/abstract/MED/6436510","http://scholar.google.com/scholar?cites=16710338666942032228&as_sdt=5,33&sciodt=0,33&hl=en&num=20",523,"2014-11-20",""
44,"…, B Rajkapoor, RS Kumar, JW Einstein…","Hepatoprotective and antioxidant effect of Pisonia aculeata L. against CCl4-induced hepatic damage in rats",2008,"Scientia …","scipharm.at","","http://scholar.google.com/scholar?cites=12535473335632113094&as_sdt=5,33&sciodt=0,33&hl=en&num=20",524,"2014-11-20","PDF"
49,"DJ Brenner, I Shuryak, AJ Einstein","Impact of reduced patient life expectancy on potential cancer risks from radiologic imaging",2011,"Radiology","pubs.rsna.org","http://pubs.rsna.org/doi/abs/10.1148/radiol.11102452","http://scholar.google.com/scholar?cites=783670978210824213&as_sdt=5,33&sciodt=0,33&hl=en&num=20",525,"2014-11-20",""
39,"HA Einstein","Bed-load transportation in Mountain Creek",1944,"","agris.fao.org","","http://scholar.google.com/scholar?cites=13568636723023310885&as_sdt=5,33&sciodt=0,33&hl=en&num=20",526,"2014-11-20","CITATION"
39,"HH Einstein","Risk analysis for rock slopes in open pit mines",1981,"","NTIS","","http://scholar.google.com/scholar?cites=1526165080068537440&as_sdt=5,33&sciodt=0,33&hl=en&num=20",527,"2014-11-20","CITATION"
43,"E Lubrin, E Lawrence…","Wireless remote healthcare monitoring with motes",2005,"Mobile Business, 2005. …","ieeexplore.ieee.org","http://ieeexplore.ieee.org/xpls/abs_all.jsp?arnumber=1493614","http://scholar.google.com/scholar?cites=15949136266798657473&as_sdt=5,33&sciodt=0,33&hl=en&num=20",528,"2014-11-20",""
38,"LR Martin, FWB Einstein, RK Pomeroy","Synthesis, structure, and fluxional properties of the novel tetranuclear osmium clusters Os4 (CO) n (PMe3)(n= 15, 14, 13)",1988,"Organometallics","ACS Publications","http://pubs.acs.org/doi/abs/10.1021/om00092a010","http://scholar.google.com/scholar?cites=13079641313111401773&as_sdt=5,33&sciodt=0,33&hl=en&num=20",529,"2014-11-20",""
39,"…, JB Paine III, D Dolphin, FWB Einstein…","Enforced deformation of porphyrins by short-strap bridging",1983,"Journal of the …","ACS Publications","http://pubs.acs.org/doi/abs/10.1021/ja00360a051","http://scholar.google.com/scholar?cites=13766781063206266036&as_sdt=5,33&sciodt=0,33&hl=en&num=20",530,"2014-11-20",""
37,"A Einstein, W Mayer","Semi‐Vektoren und Spinoren",1932,"","Wiley Online Library","","http://scholar.google.com/scholar?cites=15247421241569909528&as_sdt=5,33&sciodt=0,33&hl=en&num=20",531,"2014-11-20","BOOK"
37,"SV Khare, TL Einstein","Energetics of steps and kinks on Ag and Pt using equivalent crystal theory (ECT)",1994,"Surface science","Elsevier","http://www.sciencedirect.com/science/article/pii/0039602894902070","http://scholar.google.com/scholar?cites=4859267450181861293&as_sdt=5,33&sciodt=0,33&hl=en&num=20",532,"2014-11-20",""
40,"CC Hian, WO Einstein","Quality of Work Life (QWL): What can unions do",1990,"SAM Advanced Management Journal","The Free Press","","http://scholar.google.com/scholar?cites=16830482586899030632&as_sdt=5,33&sciodt=0,33&hl=en&num=20",533,"2014-11-20","CITATION"
37,"AB Einstein Jr, DL Mann, HG Gorden, RJ Trapani…","Heterologous antisera against specific HL-A antigens.",1971,"…","journals.lww.com","http://journals.lww.com/transplantjournal/Abstract/1971/10000/Heterologous_Antisera_Against_Specific_Hl_A.11.aspx","http://scholar.google.com/scholar?cites=15405683787867596502&as_sdt=5,33&sciodt=0,33&hl=en&num=20",534,"2014-11-20",""
40,"MK Scullin, GO Einstein, MA McDaniel","Evidence for spontaneous retrieval of suspended but not finished prospective memories",2009,"Memory & Cognition","Springer","http://link.springer.com/article/10.3758/MC.37.4.425","http://scholar.google.com/scholar?cites=8058339168603509937&as_sdt=5,33&sciodt=0,33&hl=en&num=20",535,"2014-11-20",""
41,"DA Einstein, PF Lovibond…","Relationship between perfectionism and emotional symptoms in an adolescent sample",2000,"Australian Journal of …","Wiley Online Library","http://onlinelibrary.wiley.com/doi/10.1080/00049530008255373/full","http://scholar.google.com/scholar?cites=10296846440761959441&as_sdt=5,33&sciodt=0,33&hl=en&num=20",536,"2014-11-20",""
38,"M Vermess, KD Pearson, AB Einstein, JL Fahey","Osseous Manifestations of Waldenström's Macroglobulinemia 1",1972,"Radiology","pubs.rsna.org","http://pubs.rsna.org/doi/abs/10.1148/102.3.497","http://scholar.google.com/scholar?cites=16017262169401925104&as_sdt=5,33&sciodt=0,33&hl=en&num=20",537,"2014-11-20",""
39,"BR Herts, DM Paushter, DM Einstein…","Use of contrast material for spiral CT of the abdomen: comparison of hepatic enhancement and vascular attenuation for three different contrast media at two different …",1995,"… American journal of …","Am Roentgen Ray Soc","http://www.ajronline.org/doi/abs/10.2214/ajr.164.2.7839963","http://scholar.google.com/scholar?cites=2108653349149786730&as_sdt=5,33&sciodt=0,33&hl=en&num=20",538,"2014-11-20",""
37,"HA Einstein","River sedimentation",1964,"Handbook of Applied Hydrology","NY: McGraw-Hill Book Co","","http://scholar.google.com/scholar?cites=17193039812299020256&as_sdt=5,33&sciodt=0,33&hl=en&num=20",539,"2014-11-20","CITATION"
38,"FWB Einstein, AC Willis","Crystal and molecular structure of. mu.-carbonato-di-. mu.-chloro-tetrakis (bis (3-aminopropyl) amine) tetracopper (II) chloride hydrate",1981,"Inorganic Chemistry","ACS Publications","http://pubs.acs.org/doi/abs/10.1021/ic50216a054","http://scholar.google.com/scholar?cites=233757945492756125&as_sdt=5,33&sciodt=0,33&hl=en&num=20",540,"2014-11-20",""
38,"A Einstein","Théorie de la Relativité",1933,"","ams.org","","http://scholar.google.com/scholar?cites=16041346503445625043&as_sdt=5,33&sciodt=0,33&hl=en&num=20",541,"2014-11-20","CITATION"
36,"…, C Yiannikas, JGL Morris, R Einstein…","Postural tremor of Parkinson's disease",1994,"Clinical …","journals.lww.com","http://journals.lww.com/clinicalneuropharm/Abstract/1994/06000/Postural_Tremor_of_Parkinson_s_Disease.7.aspx","http://scholar.google.com/scholar?cites=8376600610898611834&as_sdt=5,33&sciodt=0,33&hl=en&num=20",542,"2014-11-20",""
37,"A Einstein","A brief outline of the development of the theory of relativity",1921,"Nature","nature.com","http://www.nature.com/physics/looking-back/einstein/","http://scholar.google.com/scholar?cites=12875216717199061698&as_sdt=5,33&sciodt=0,33&hl=en&num=20",543,"2014-11-20",""
37,"CJ Hearn, A Einstein","The dynamics of coastal models",2008,"","tos.org","","http://scholar.google.com/scholar?cites=11658329895516631291&as_sdt=5,33&sciodt=0,33&hl=en&num=20",544,"2014-11-20","BOOK"
37,"A Einstein, J Stachel","The collected papers of Albert Einstein. Vol. 1, The early years, 1879-1902",1987,"","Princeton University Press","","http://scholar.google.com/scholar?cites=2755521637680421443&as_sdt=5,33&sciodt=0,33&hl=en&num=20",545,"2014-11-20","CITATION"
38,"N Fainstein, I Vaknin, O Einstein, P Zisman…","Neural precursor cells inhibit multiple inflammatory signals",2008,"Molecular and Cellular …","Elsevier","http://www.sciencedirect.com/science/article/pii/S1044743108001899","http://scholar.google.com/scholar?cites=3257129129903686554&as_sdt=5,33&sciodt=0,33&hl=en&num=20",546,"2014-11-20",""
37,"T Valcana, ER Einstein, J Csejtey, KB Dalal…","Influence of thyroid hormones on myelin proteins in the developing rat brain",1975,"Journal of the …","Elsevier","http://www.sciencedirect.com/science/article/pii/0022510X75901835","http://scholar.google.com/scholar?cites=17597996147493828389&as_sdt=5,33&sciodt=0,33&hl=en&num=20",547,"2014-11-20",""
37,"P Hyldgaard, TL Einstein","Surface-state–mediated three-adsorbate interaction",2002,"EPL (Europhysics Letters)","iopscience.iop.org","http://iopscience.iop.org/0295-5075/59/2/265","http://scholar.google.com/scholar?cites=10793759274416542107&as_sdt=5,33&sciodt=0,33&hl=en&num=20",548,"2014-11-20",""
36,"…, HC Rauch, J Clausen, ER Einstein","Changes in cathepsins B-1 and D, neutral proteinase and 2′, 3′-cyclic nucleotide-3′-phosphohydrolase activities in monkey brain with experimental allergic …",1974,"Journal of the …","Elsevier","http://www.sciencedirect.com/science/article/pii/0022510X74902329","http://scholar.google.com/scholar?cites=4953176203449619588&as_sdt=5,33&sciodt=0,33&hl=en&num=20",549,"2014-11-20",""
36,"NC Bartelt, TL Einstein, C Rottman","First-order transitions between surface phases with different step structures",1991,"Physical review letters","APS","","http://scholar.google.com/scholar?cites=2721983643768429005&as_sdt=5,33&sciodt=0,33&hl=en&num=20",550,"2014-11-20","CITATION"
36,"WW Pai, JS Ozcomert, NC Bartelt, TL Einstein…","Terrace-width distributions on vicinal Ag (110): evidence of oscillatory interactions",1994,"Surface science","Elsevier","http://www.sciencedirect.com/science/article/pii/0039602894914877","http://scholar.google.com/scholar?cites=16411314128953619999&as_sdt=5,33&sciodt=0,33&hl=en&num=20",551,"2014-11-20",""
36,"TL Einstein","Short-chain model of chemisorption: Exact and approximate results",1975,"Physical Review B","APS","http://journals.aps.org/prb/abstract/10.1103/PhysRevB.11.577","http://scholar.google.com/scholar?cites=3036173745943812547&as_sdt=5,33&sciodt=0,33&hl=en&num=20",552,"2014-11-20",""
39,"DM Einstein, BR Herts, R Weaver…","Evaluation of renal masses detected by excretory urography: cost-effectiveness of sonography versus CT.",1995,"… American journal of …","Am Roentgen Ray Soc","http://www.ajronline.org/doi/abs/10.2214/ajr.164.2.7839971","http://scholar.google.com/scholar?cites=12567578733978616743&as_sdt=5,33&sciodt=0,33&hl=en&num=20",553,"2014-11-20",""
