Cites,Authors,Title,Year,Source,Publisher,ArticleURL,CitesURL,GSRank,QueryDate,Type
29,"JP Allain, Y Laurian, MH Einstein…","Monitoring of specific antibodies to human immunodeficiency virus structural proteins: clinical significance",1991,"…","bloodjournal.hematologylibrary.org","http://bloodjournal.hematologylibrary.org/content/77/5/1118.short","http://scholar.google.com/scholar?cites=11784794758609665380&as_sdt=5,33&sciodt=0,33&hl=en&num=20",709,"2014-11-20",""
28,"S Hati, RJ Batchelor, FWB Einstein…","Vanadium (V) Complexes of α-Hydroxycarboxylic Acids in Aqueous Solution",2001,"Inorganic …","ACS Publications","http://pubs.acs.org/doi/abs/10.1021/ic010427m","http://scholar.google.com/scholar?cites=756851432553241757&as_sdt=5,33&sciodt=0,33&hl=en&num=20",710,"2014-11-20",""
155,"A Einstein, L Infeld, G Rebuá","A evolução da física",1980,"","zahar.com.br","","http://scholar.google.com/scholar?cites=9519725340936442534&as_sdt=5,33&sciodt=0,33&hl=en&num=20",711,"2014-11-20","BOOK"
27,"…, A Sheffet, S Einstein…","Survey of drug abuse in six New Jersey high schools: II. Characteristics of drug users and non-users",1972,"… of the First …","Baywood Farmingdale, New York","","http://scholar.google.com/scholar?cites=959413577199638488&as_sdt=5,33&sciodt=0,33&hl=en&num=20",712,"2014-11-20","CITATION"
36,"A Einstein","The ultimate quotable Einstein",2010,"","books.google.com","","http://scholar.google.com/scholar?cites=7359693068800950432&as_sdt=5,33&sciodt=0,33&hl=en&num=20",713,"2014-11-20","BOOK"
28,"C Einstein","The fireside book of baseball",1987,"","Fireside","","http://scholar.google.com/scholar?cites=3679556139911962273&as_sdt=5,33&sciodt=0,33&hl=en&num=20",714,"2014-11-20","CITATION"
27,"A Einstein","Fund-raising telegram for the Emergency Committee of Atomic Scientists, 23 May 1946",1960,"Einstein on peace","","","http://scholar.google.com/scholar?cites=2850569474929409432&as_sdt=5,33&sciodt=0,33&hl=en&num=20",715,"2014-11-20","CITATION"
33,"G Einstein","From body to brain: considering the neurobiological effects of female genital cutting",2008,"Perspectives in biology and medicine","muse.jhu.edu","http://muse.jhu.edu/journals/pbm/summary/v051/51.1einstein.html","http://scholar.google.com/scholar?cites=10323350162374575402&as_sdt=5,33&sciodt=0,33&hl=en&num=20",716,"2014-11-20",""
27,"DJ Liu, TL Einstein, PA Sterne, LT Wille","Phase diagram of a two-dimensional lattice-gas model of oxygen ordering in YBa 2 Cu 3 O z with realistic interactions",1995,"Physical Review B","APS","http://journals.aps.org/prb/abstract/10.1103/PhysRevB.52.9784","http://scholar.google.com/scholar?cites=10018876383830107922&as_sdt=5,33&sciodt=0,33&hl=en&num=20",717,"2014-11-20",""
27,"NI Gelperin, VG Einstein, JF Davidson, D Harrison","Fluidization",1971,"edited by JF Davidson and D. …","","","http://scholar.google.com/scholar?cites=3548723322892711252&as_sdt=5,33&sciodt=0,33&hl=en&num=20",718,"2014-11-20","CITATION"
27,"CR Weisbin, BL Burks, JR Einstein, RR Feezell…","HERMIES-III: A step toward autonomous mobility, manipulation and perception",1990,"…","Cambridge Univ Press","http://journals.cambridge.org/abstract_S0263574700007268","http://scholar.google.com/scholar?cites=15000425832548649359&as_sdt=5,33&sciodt=0,33&hl=en&num=20",719,"2014-11-20",""
28,"GL Hardgrove, JR Einstein, CH Wei","Structure of p-(p-nitroanilino) phenyl isothiocyanate, C13H9N3O2S",1983,"Acta Crystallographica Section …","scripts.iucr.org","http://scripts.iucr.org/cgi-bin/paper?a22438","http://scholar.google.com/scholar?cites=47519839761658540&as_sdt=5,33&sciodt=0,33&hl=en&num=20",720,"2014-11-20",""
27,"Y Xu, D Xu, OH Crawford, J ralph Einstein…","Protein threading by PROSPECT: a prediction experiment in CASP3",1999,"Protein …","Oxford Univ Press","http://peds.oxfordjournals.org/content/12/11/899.short","http://scholar.google.com/scholar?cites=14822159372409805308&as_sdt=5,33&sciodt=0,33&hl=en&num=20",721,"2014-11-20",""
28,"MH Einstein, DM Kushner, JP Connor…","A protocol of dual prophylaxis for venous thromboembolism prevention in gynecologic cancer patients",2008,"Obstetrics & …","journals.lww.com","http://journals.lww.com/greenjournal/Abstract/2008/11000/A_Protocol_of_Dual_Prophylaxis_for_Venous.18.aspx","http://scholar.google.com/scholar?cites=6858999971636704774&as_sdt=5,33&sciodt=0,33&hl=en&num=20",722,"2014-11-20",""
34,"…, D Saloner, DR Einstein…","A computationally efficient formal optimization of regional myocardial contractility in a sheep with left ventricular aneurysm",2009,"Journal of …","… .asmedigitalcollection.asme.org","http://medicaldevices.asmedigitalcollection.asme.org/article.aspx?articleid=1475789","http://scholar.google.com/scholar?cites=4905219409360344809&as_sdt=5,33&sciodt=0,33&hl=en&num=20",723,"2014-11-20",""
29,"…, H Chen, RH Muzumdar, FH Einstein…","Comparison between surrogate indexes of insulin sensitivity/resistance and hyperinsulinemic euglycemic clamp estimates in rats",2009,"American Journal of …","Am Physiological Soc","","http://scholar.google.com/scholar?cites=7118767888687444758&as_sdt=5,33&sciodt=0,33&hl=en&num=20",724,"2014-11-20","HTML"
32,"…, P Sukumvanich, GL Goldberg, MH Einstein","Serum CA125 predicts extrauterine disease and survival in uterine carcinosarcoma",2007,"Gynecologic …","Elsevier","http://www.sciencedirect.com/science/article/pii/S0090825807006282","http://scholar.google.com/scholar?cites=4201348506340907264&as_sdt=5,33&sciodt=0,33&hl=en&num=20",725,"2014-11-20",""
141,"A Einstein","Auf die riemann-metrik und den fern-parallelismus gegründete einheitliche feldtheorie",1930,"Mathematische Annalen","Springer","http://www.springerlink.com/index/X28X013856QG0520.pdf","http://scholar.google.com/scholar?cites=14077342355812381211&as_sdt=5,33&sciodt=0,33&hl=en&num=20",726,"2014-11-20",""
27,"FWB Einstein, VJ Johnston, RK Pomeroy","Spiked-triangular versus puckered-square geometry in 64-electron osmium clusters. Synthesis and structure of Os4 (CO) 15 (L)(L= CO, PF3, P (OCH2) 3CMe)",1990,"Organometallics","ACS Publications","http://pubs.acs.org/doi/abs/10.1021/om00160a024","http://scholar.google.com/scholar?cites=1503843002557691966&as_sdt=5,33&sciodt=0,33&hl=en&num=20",727,"2014-11-20",""
27,"VJ Johnston, FWB Einstein…","Structures of the new binary metal carbonyl Os4 (CO) 15 and (. eta. 5-C5Me5)(OC) IrOs3 (CO) 11. Clusters with three-center-two-electron metal-metal bonds?",1987,"Journal of the American …","ACS Publications","http://pubs.acs.org/doi/abs/10.1021/ja00257a069","http://scholar.google.com/scholar?cites=12179362943171518224&as_sdt=5,33&sciodt=0,33&hl=en&num=20",728,"2014-11-20",""
27,"…, SA Lumb, RJ Batchelor, FWB Einstein","Facile Thermal Reactivity of Cp* W (NO)(CH2SiMe3)(CPh: CH2): Unique Alkane CH Activation under Mild Conditions",1995,"Journal of the …","ACS Publications","http://pubs.acs.org/doi/abs/10.1021/ja00116a040","http://scholar.google.com/scholar?cites=11030270462829228287&as_sdt=5,33&sciodt=0,33&hl=en&num=20",729,"2014-11-20",""
27,"…, AC Willis, JF Petrignani, FWB Einstein","Novel reaction of metal-metal triple-bonded complexes and nitro compounds. Decarbonylation and the formation of high oxidation state molybdenum and tungsten …",1983,"Journal of the American …","ACS Publications","http://pubs.acs.org/doi/abs/10.1021/ja00344a074","http://scholar.google.com/scholar?cites=4602698300405541462&as_sdt=5,33&sciodt=0,33&hl=en&num=20",730,"2014-11-20",""
27,"RJ Batchelor, HB Davis, FWB Einstein…","Unprecedented bonding mode in osmium complex (OC) 3 [MeC (CH2O) 3P] 2OsOs (CO) 4W (CO) 5",1990,"Journal of the …","ACS Publications","http://pubs.acs.org/doi/abs/10.1021/ja00161a079","http://scholar.google.com/scholar?cites=13660164890681500052&as_sdt=5,33&sciodt=0,33&hl=en&num=20",731,"2014-11-20",""
28,"AR Davis, FWB Einstein","Eight-coordination and hydrogen bonding in a complex of scandium. Crystal structure of the acid dimer of tetrakis (tropolonato) scandium (III)",1974,"Inorganic Chemistry","ACS Publications","http://pubs.acs.org/doi/abs/10.1021/ic50138a018","http://scholar.google.com/scholar?cites=17014575756804270872&as_sdt=5,33&sciodt=0,33&hl=en&num=20",732,"2014-11-20",""
27,"…, GN Van Buuren, RK Pomeroy, FWB Einstein","Synthesis and structure of Os3 (CO) 12 (SiCl3) 2, a compound with a linear SiOs3Si backbone. Structure of Os3 (. mu.-H) 3 (CO) 9 (SiCl3) 3",1983,"Inorganic …","ACS Publications","http://pubs.acs.org/doi/abs/10.1021/ic00150a004","http://scholar.google.com/scholar?cites=17576773468321176728&as_sdt=5,33&sciodt=0,33&hl=en&num=20",733,"2014-11-20",""
27,"A Einstein, A Einstein","Philosopher-Scientist, ed",1970,"PA Schillp, Open Court, La Salle, Illinois","","","http://scholar.google.com/scholar?cites=1039594870121307294&as_sdt=5,33&sciodt=0,33&hl=en&num=20",734,"2014-11-20","CITATION"
138,"A Einstein","Über die vom Relativitätsprinzip geforderte Trägheit der Energie",1907,"Annalen der Physik","Wiley Online Library","http://onlinelibrary.wiley.com/doi/10.1002/andp.19073280713/abstract","http://scholar.google.com/scholar?cites=10320003497099631215&as_sdt=5,33&sciodt=0,33&hl=en&num=20",735,"2014-11-20",""
26,"…, CA Burrus, BL Kasper, G Einstein…","WDM coherent optical star network",1988,"Lightwave …","ieeexplore.ieee.org","http://ieeexplore.ieee.org/xpls/abs_all.jsp?arnumber=3966","http://scholar.google.com/scholar?cites=17505392476659081780&as_sdt=5,33&sciodt=0,33&hl=en&num=20",736,"2014-11-20",""
27,"B Sivapathasundharam, A Einstein, RI Syed","Desmoplastic ameloblastoma in Indians: report of five cases and review of literature",2007,"Indian Journal of Dental …","ijdr.in","","http://scholar.google.com/scholar?cites=6605673818732325347&as_sdt=5,33&sciodt=0,33&hl=en&num=20",737,"2014-11-20","HTML"
27,"ENGC SAW, LE SMALE, H EINSTEIN…","Female genital coccidioidomycosis",1975,"Obstetrics & …","journals.lww.com","http://journals.lww.com/greenjournal/Abstract/1975/02000/Female_Genital_Coccidioidomycosis.20.aspx","http://scholar.google.com/scholar?cites=2096899813305202586&as_sdt=5,33&sciodt=0,33&hl=en&num=20",738,"2014-11-20",""
26,"A Einstein, HA Lorentz, H Weyl, H Minkowski","The principle of relativity",2008,"","kerrykkuehn.com","","http://scholar.google.com/scholar?cites=15986917800028662144&as_sdt=5,33&sciodt=0,33&hl=en&num=20",739,"2014-11-20","BOOK"
26,"N Einstein, A Baker, J Galper, H Wolfe","Jaundice due to nicotinic acid therapy",1975,"The American journal of digestive …","Springer","http://link.springer.com/article/10.1007/BF01070732","http://scholar.google.com/scholar?cites=11887692509739540427&as_sdt=5,33&sciodt=0,33&hl=en&num=20",740,"2014-11-20",""
26,"A Einstein","Fundamental ideas and problems of the theory of relativity",1923,"Les Prix Nobel 1922","globaluno.com","","http://scholar.google.com/scholar?cites=7623326492147812971&as_sdt=5,33&sciodt=0,33&hl=en&num=20",741,"2014-11-20","PDF"
26,"L Einstein","Divided loyalties: Americans in England during the War of Independence",1971,"","Scholarly Press","","http://scholar.google.com/scholar?cites=11229037861751951121&as_sdt=5,33&sciodt=0,33&hl=en&num=20",742,"2014-11-20","CITATION"
26,"M Krushch, E Worrell, L Price, N Martin, D Einstein","Carbon emissions reduction potential in the US chemicals and pulp and paper industries by applying CHP technologies",1999,"","eere.energy.gov","","http://scholar.google.com/scholar?cites=14274110696221601341&as_sdt=5,33&sciodt=0,33&hl=en&num=20",743,"2014-11-20","PDF"
135,"A Einstein","Experimenteller nachweis der ampereschen molekularströme",1915,"Naturwissenschaften","Springer","http://www.springerlink.com/index/JH64653KMJ73G706.pdf","http://scholar.google.com/scholar?cites=6348225310970304992&as_sdt=5,33&sciodt=0,33&hl=en&num=20",744,"2014-11-20",""
26,"A Pimpinelli, H Gebremariam, TL Einstein","Evolution of terrace-width distributions on vicinal surfaces: Fokker-Planck derivation of the generalized Wigner surmise",2005,"Physical review letters","APS","http://journals.aps.org/prl/abstract/10.1103/PhysRevLett.95.246101","http://scholar.google.com/scholar?cites=2685803690806163030&as_sdt=5,33&sciodt=0,33&hl=en&num=20",745,"2014-11-20",""
27,"HH Einstein","Modern developments in discontinuity analysis-the persistence-connectivity problem",1993,"Comprehensive rock engineering","","","http://scholar.google.com/scholar?cites=8368901775508995718&as_sdt=5,33&sciodt=0,33&hl=en&num=20",746,"2014-11-20","CITATION"
28,"…, DH Bache, DL Harris, ME Einstein…","A bioeconomic profit function for swine production: application to developing optimal multitrait selection indexes1",1990,"Journal of Animal …","Wiley Online Library","http://onlinelibrary.wiley.com/doi/10.1111/j.1439-0388.1990.tb00043.x/abstract","http://scholar.google.com/scholar?cites=4133057050163049427&as_sdt=5,33&sciodt=0,33&hl=en&num=20",747,"2014-11-20",""
26,"…, JS Kasalko, RP Cochran, DR Einstein…","Biaxial mechanical properties of porcine ascending aortic wall tissue.",2002,"The Journal of heart …","europepmc.org","http://europepmc.org/abstract/MED/12358405","http://scholar.google.com/scholar?cites=1778720329771030633&as_sdt=5,33&sciodt=0,33&hl=en&num=20",748,"2014-11-20",""
27,"JM Bewley, ME Einstein, MW Grott, MM Schutz","Comparison of reticular and rectal core body temperatures in lactating dairy cows",2008,"Journal of dairy science","Elsevier","http://www.sciencedirect.com/science/article/pii/S0022030208709330","http://scholar.google.com/scholar?cites=408946287169956380&as_sdt=5,33&sciodt=0,33&hl=en&num=20",749,"2014-11-20",""
26,"…, PV Preckel, ME Einstein","Prediction of daily protein accretion rates of pigs from estimates of fat-free lean gain between 20 and 120 kilograms live weight.",1996,"Journal of animal …","journalofanimalscience.org","http://www.journalofanimalscience.org/content/74/3/498.short","http://scholar.google.com/scholar?cites=17497945362176953917&as_sdt=5,33&sciodt=0,33&hl=en&num=20",750,"2014-11-20",""
29,"TB Einstein, B Sivapathasundharam","Cytomorphometric analysis of the buccal mucosa of tobacco users.",2004,"Indian journal of dental …","europepmc.org","http://europepmc.org/abstract/MED/16372791","http://scholar.google.com/scholar?cites=7264248383221978086&as_sdt=5,33&sciodt=0,33&hl=en&num=20",751,"2014-11-20",""
26,"HL Richards, SD Cohen, TL Einstein, M Giesen","Extraction of step-repulsion strengths from terrace width distributions: statistical and analytical considerations",2000,"Surface science","Elsevier","http://www.sciencedirect.com/science/article/pii/S0039602800003034","http://scholar.google.com/scholar?cites=15232232390932133589&as_sdt=5,33&sciodt=0,33&hl=en&num=20",752,"2014-11-20",""
26,"KB Cummings, WU Shipley, AB Einstein…","Current concepts in the management of patients with deeply invasive bladder carcinoma.",1979,"Seminars in …","ncbi.nlm.nih.gov","","http://scholar.google.com/scholar?cites=5868938617729334794&as_sdt=5,33&sciodt=0,33&hl=en&num=20",753,"2014-11-20","CITATION"
27,"MH Einstein, Y Cruz, MK El-Awady, NC Popescu…","Utilization of the human genome sequence localizes human papillomavirus type 16 DNA integrated into the TNFAIP2 gene in a fatal cervical cancer from a 39 …",2002,"Clinical cancer …","AACR","","http://scholar.google.com/scholar?cites=8198785792962244778&as_sdt=5,33&sciodt=0,33&hl=en&num=20",754,"2014-11-20","HTML"
31,"MH Einstein, M Baron, MJ Levin, A Chatterjee…","Comparison of the immunogenicity of the human papillomavirus (HPV)-16/18 vaccine and the HPV-6/11/16/18 vaccine for oncogenic non-vaccine types HPV- …",2011,"Human …","ncbi.nlm.nih.gov","","http://scholar.google.com/scholar?cites=14212165149036276897&as_sdt=5,33&sciodt=0,33&hl=en&num=20",755,"2014-11-20","HTML"
26,"MH Einstein, YY Studentsov, GYF Ho…","Combined human papillomavirus DNA and human papillomavirus‐like particle serologic assay to identify women at risk for high‐grade cervical intraepithelial …",2007,"… journal of cancer","Wiley Online Library","","http://scholar.google.com/scholar?cites=13910690133648193965&as_sdt=5,33&sciodt=0,33&hl=en&num=20",756,"2014-11-20","HTML"
28,"AS Kadish, MH Einstein","Vaccine strategies for human papillomavirus-associated cancers",2005,"Current opinion in oncology","journals.lww.com","http://journals.lww.com/co-oncology/Abstract/2005/09000/Vaccine_strategies_for_human.7.aspx","http://scholar.google.com/scholar?cites=16727182366079496258&as_sdt=5,33&sciodt=0,33&hl=en&num=20",757,"2014-11-20",""
38,"MH Einstein, M Baron, MJ Levin…","Comparative immunogenicity and safety of human papillomavirus (HPV)-16/18 vaccine and HPV-6/11/16/18 vaccine: Follow-up from Months 12–24 in a Phase III …",2011,"Human …","landesbioscience.com","http://www.landesbioscience.com/journals/hv/article/18281/","http://scholar.google.com/scholar?cites=15256690292789217864&as_sdt=5,33&sciodt=0,33&hl=en&num=20",758,"2014-11-20",""
27,"HH Einstein, WS Dershowitz","Tensile and shear fracturing in predominantly compressive stress fields—a review",1990,"Engineering Geology","Elsevier","http://www.sciencedirect.com/science/article/pii/001379529090004K","http://scholar.google.com/scholar?cites=5060439933780127723&as_sdt=5,33&sciodt=0,33&hl=en&num=20",759,"2014-11-20",""
136,"A Einstein, LP Williams","La teoría de la relatividad",1993,"","red.universitam.com","","http://scholar.google.com/scholar?cites=6867202997729665327&as_sdt=5,33&sciodt=0,33&hl=en&num=20",760,"2014-11-20","BOOK"
133,"A Einstein","Dialog über Einwände gegen die Relativitätstheorie",1918,"Naturwissenschaften","Springer","http://www.springerlink.com/index/H23UT1W657678778.pdf","http://scholar.google.com/scholar?cites=8454935971837435414&as_sdt=5,33&sciodt=0,33&hl=en&num=20",761,"2014-11-20",""
26,"JA Carroll, RE Cobbledick, FWB Einstein…","Aryldiazenido, aryldiazene, and arylhydrazido complexes. Reaction of diazonium ions with carbonylhydridotris (triphenylphosphine) iridium (I) and the x-ray structures …",1977,"Inorganic …","ACS Publications","http://pubs.acs.org/doi/abs/10.1021/ic50176a007","http://scholar.google.com/scholar?cites=11238247298349438457&as_sdt=5,33&sciodt=0,33&hl=en&num=20",762,"2014-11-20",""
27,"…, SA Lumb, RJ Batchelor, FWB Einstein","Generation and Reactivity of CpW (NO)(CH2SiMe3) H, a 16-Valence-Electron Alkyl Hydride Complex",1995,"…","ACS Publications","http://pubs.acs.org/doi/abs/10.1021/om00005a061","http://scholar.google.com/scholar?cites=4783820261981857681&as_sdt=5,33&sciodt=0,33&hl=en&num=20",763,"2014-11-20",""
26,"FWB Einstein, KG Tyers, AS Tracey…","Synthesis, structures and nonrigidity of heterotrimetallic alkyne clusters of the type CpNiCoM (CO) 6 (C2RR')(M= Fe, Ru, Os)",1986,"Inorganic Chemistry","ACS Publications","http://pubs.acs.org/doi/abs/10.1021/ic00230a022","http://scholar.google.com/scholar?cites=11657421464014954233&as_sdt=5,33&sciodt=0,33&hl=en&num=20",764,"2014-11-20",""
28,"C De los Santos Jr, P Sorgeloos…","Successful inoculation of Artemia and production of cysts in man-made salterns in the Philippines.",1980,"In: Persoone, G., …","repository.seafdec.org.ph","http://repository.seafdec.org.ph/handle/10862/230","http://scholar.google.com/scholar?cites=18040997350551773598&as_sdt=5,33&sciodt=0,33&hl=en&num=20",765,"2014-11-20",""
132,"A Einstein, G Cros","Comment je vois le monde",1934,"","wearealgerians.com","","http://scholar.google.com/scholar?cites=2809243572575711506&as_sdt=5,33&sciodt=0,33&hl=en&num=20",766,"2014-11-20","BOOK"
130,"A Einstein","Riemann‐Geometrie mit Aufrechterhaltung des Begriffes des Fernparallelismus",1928,"","Wiley Online Library","","http://scholar.google.com/scholar?cites=13917004136595895956&as_sdt=5,33&sciodt=0,33&hl=en&num=20",767,"2014-11-20","BOOK"
25,"AB Carr, R Einstein, LYC Lai, NG Martin…","Vitamin C and the common cold: a second MZ Cotwin control study",1981,"Acta Genet Med …","keppel.qimr.edu.au","","http://scholar.google.com/scholar?cites=6986157685098482965&as_sdt=5,33&sciodt=0,33&hl=en&num=20",768,"2014-11-20","PDF"
25,"A Einstein","Cited in Pais, A.(1982)"" Subtle is the Lord..."". The science and life of Albert Einstein",1930,"","Clarendon Press.[rPRK]","","http://scholar.google.com/scholar?cites=856813392444774659&as_sdt=5,33&sciodt=0,33&hl=en&num=20",769,"2014-11-20","CITATION"
25,"M Einstein, M Greenlee, G Rouen, A Sitlani…","Selective glucocorticoid receptor nonsteroidal ligands completely antagonize the dexamethasone mediated induction of enzymes involved in gluconeogenesis and …",2004,"The Journal of steroid …","Elsevier","http://www.sciencedirect.com/science/article/pii/S0960076004003887","http://scholar.google.com/scholar?cites=12761253302117902458&as_sdt=5,33&sciodt=0,33&hl=en&num=20",770,"2014-11-20",""
26,"A Einstein, W Pauli, K Gödel, A Gamba","Autobiografia scientifica",1979,"","Bollati Boringhieri","","http://scholar.google.com/scholar?cites=4742164056777168989&as_sdt=5,33&sciodt=0,33&hl=en&num=20",771,"2014-11-20","CITATION"
127,"A Einstein","Hamiltonsches Prinzip und allgemeine Relativitätstheorie",1916,"… Akademie der Wissenschaften (Berlin), Seite 1111- …","adsabs.harvard.edu","","http://scholar.google.com/scholar?cites=2197792240698702671&as_sdt=5,33&sciodt=0,33&hl=en&num=20",772,"2014-11-20","CITATION"
25,"GO Einstein, MA McDaniel, R Thomas, S Mayfield…","N. 2005. Multiple processes in prospective memory retrieval: Factors determining monitoring versus spontaneous retrieval",0,"Journal of Experimental …","","","http://scholar.google.com/scholar?cites=11174875168451388460&as_sdt=5,33&sciodt=0,33&hl=en&num=20",773,"2014-11-20","CITATION"
25,"TL Einstein","Using the Wigner–Ibach surmise to analyze terrace-width distributions: history, user's guide, and advances",2007,"Applied Physics A","Springer","http://link.springer.com/article/10.1007/s00339-007-3908-x","http://scholar.google.com/scholar?cites=2950285905661583945&as_sdt=5,33&sciodt=0,33&hl=en&num=20",774,"2014-11-20",""
25,"RH Johnson, JW Caldwell, G Welch, HE Einstein","The great coccidioidomycosis epidemic: clinical features",1996,"… . Proceedings of the 5th …","","","http://scholar.google.com/scholar?cites=7800527679599030169&as_sdt=5,33&sciodt=0,33&hl=en&num=20",775,"2014-11-20","CITATION"
27,"KP Chong, VC Li, HH Einstein","Size effects, process zone and tension softening behavior in fracture of geomaterials",1989,"Engineering fracture mechanics","Elsevier","http://www.sciencedirect.com/science/article/pii/001379448990129X","http://scholar.google.com/scholar?cites=11403935151734293519&as_sdt=5,33&sciodt=0,33&hl=en&num=20",776,"2014-11-20",""
25,"RA Einstein","Sialography in the differential diagnosis of parotid masses.",1966,"Surgery, gynecology & obstetrics","ncbi.nlm.nih.gov","","http://scholar.google.com/scholar?cites=18426830250014867061&as_sdt=5,33&sciodt=0,33&hl=en&num=20",777,"2014-11-20","CITATION"
25,"AJ Einstein, J Gil, S Wallenstein, CA Bodian…","Reproducibility and accuracy of interactive segmentation procedures for image analysis in cytology",1997,"Journal of …","Wiley Online Library","http://onlinelibrary.wiley.com/doi/10.1046/j.1365-2818.1997.2510808.x/full","http://scholar.google.com/scholar?cites=5676713738748261398&as_sdt=5,33&sciodt=0,33&hl=en&num=20",778,"2014-11-20",""
25,"…, MC Tesi, AL Stella, TL Einstein","Self-avoiding random surfaces: Monte Carlo study using oct-tree data-structure",1991,"Journal of Physics A: …","iopscience.iop.org","http://iopscience.iop.org/0305-4470/24/19/024","http://scholar.google.com/scholar?cites=1162955268884117302&as_sdt=5,33&sciodt=0,33&hl=en&num=20",779,"2014-11-20",""
25,"FWB Einstein, RDG Jones","Crystal structure of ethylidyneheptacarbonyl-. mu.-[1, 2-bis (dimethylarsino) tetrafluorocyclobutene]-triangulo-tricobalt",1972,"Inorganic Chemistry","ACS Publications","http://pubs.acs.org/doi/abs/10.1021/ic50108a038","http://scholar.google.com/scholar?cites=4892171911501411820&as_sdt=5,33&sciodt=0,33&hl=en&num=20",780,"2014-11-20",""
25,"J Trotter, FWB Einstein, DG Tuck","The crystal structure of tetraethylammonium tetrachloroindate (III)",1969,"Acta Crystallographica Section B: …","scripts.iucr.org","http://scripts.iucr.org/cgi-bin/paper?S0567740869002652","http://scholar.google.com/scholar?cites=6845912854307652623&as_sdt=5,33&sciodt=0,33&hl=en&num=20",781,"2014-11-20",""
25,"FWB Einstein, T Jones, RK Pomeroy…","18-Electron complexes as ligands. Synthesis, structure, and stereochemical nonrigidity of (trimethylphosphine) tetracarbonylosmium-pentacarbonyltungsten complex ( …",1984,"Journal of the …","ACS Publications","http://pubs.acs.org/doi/abs/10.1021/ja00321a043","http://scholar.google.com/scholar?cites=13399960647386856256&as_sdt=5,33&sciodt=0,33&hl=en&num=20",782,"2014-11-20",""
124,"C Einstein","Die Kunst des 20",1928,"","Propyläen-Verlag","","http://scholar.google.com/scholar?cites=11735079163539633712&as_sdt=5,33&sciodt=0,33&hl=en&num=20",783,"2014-11-20","CITATION"
125,"A Einstein","Lichtgeschwindigkeit und statik des Gravitationsfeldes",1912,"Annalen der Physik","Wiley Online Library","http://onlinelibrary.wiley.com/doi/10.1002/andp.19123430704/abstract","http://scholar.google.com/scholar?cites=12388819611652552888&as_sdt=5,33&sciodt=0,33&hl=en&num=20",784,"2014-11-20",""
25,"…, SF Maier, GO Einstein","“Brain-Specific” Nutrients: A Memory Cure?",2002,"Psychological Science in …","psi.sagepub.com","http://psi.sagepub.com/content/3/1/12.short","http://scholar.google.com/scholar?cites=10834762978466631627&as_sdt=5,33&sciodt=0,33&hl=en&num=20",785,"2014-11-20",""
30,"…, A Fiander, CJ Lacey, HC Kitchener, MH Einstein","Therapy of human papillomavirus-related disease",2012,"Vaccine","Elsevier","http://www.sciencedirect.com/science/article/pii/S0264410X1201105X","http://scholar.google.com/scholar?cites=6035107527688189446&as_sdt=5,33&sciodt=0,33&hl=en&num=20",786,"2014-11-20",""
