Cites,Authors,Title,Year,Source,Publisher,ArticleURL,CitesURL,GSRank,QueryDate,Type
12774,"A Einstein, B Podolsky, N Rosen","Can quantum-mechanical description of physical reality be considered complete?",1935,"Physical review","APS","http://journals.aps.org/pr/abstract/10.1103/PhysRev.47.777","http://scholar.google.com/scholar?cites=8174092782678430881&as_sdt=5,33&sciodt=0,33&hl=en&num=20",1,"2014-11-20",""
3330,"A Einstein","Investigations on the Theory of the Brownian Movement",1956,"","books.google.com","","http://scholar.google.com/scholar?cites=13746912682491308133&as_sdt=5,33&sciodt=0,33&hl=en&num=20",2,"2014-11-20","BOOK"
2503,"A Einstein","The meaning of relativity",2003,"","books.google.com","","http://scholar.google.com/scholar?cites=11457595862006272228&as_sdt=5,33&sciodt=0,33&hl=en&num=20",3,"2014-11-20","BOOK"
1969,"A Einstein","Relativity: The special and general theory",1920,"","books.google.com","","http://scholar.google.com/scholar?cites=6260380372219921579&as_sdt=5,33&sciodt=0,33&hl=en&num=20",4,"2014-11-20","BOOK"
1709,"A Einstein, L Infeld","The evolution of physics: the growth of ideas from early concepts to relativity and quanta",1961,"","books.google.com","","http://scholar.google.com/scholar?cites=598910928436462160&as_sdt=5,33&sciodt=0,33&hl=en&num=20",5,"2014-11-20","BOOK"
1835,"HA Einstein","The bed-load function for sediment transportation in open channel flows",1950,"","books.google.com","","http://scholar.google.com/scholar?cites=11791757726509093391&as_sdt=5,33&sciodt=0,33&hl=en&num=20",6,"2014-11-20","BOOK"
1367,"A Einstein, C Seelig, S Bargmann, I Unna, B Wolff","Ideas and opinions",1954,"","ns1.ias.ac.in","","http://scholar.google.com/scholar?cites=15860664256583570507&as_sdt=5,33&sciodt=0,33&hl=en&num=20",7,"2014-11-20","BOOK"
1118,"AJ Einstein, MJ Henzlova, S Rajagopalan","Estimating risk of cancer associated with radiation exposure from 64-slice computed tomography coronary angiography",2007,"Jama","archpedi.jamanetwork.com","http://archpedi.jamanetwork.com/article.aspx?articleid=208021","http://scholar.google.com/scholar?cites=6829692673079820513&as_sdt=5,33&sciodt=0,33&hl=en&num=20",8,"2014-11-20",""
1001,"A Einstein, FA Davis","The principle of relativity",2013,"","books.google.com","","http://scholar.google.com/scholar?cites=10222925839632055980&as_sdt=5,33&sciodt=0,33&hl=en&num=20",9,"2014-11-20","BOOK"
902,"GO Einstein, MA McDaniel","Normal aging and prospective memory.",1990,"Journal of Experimental Psychology: …","psycnet.apa.org","http://psycnet.apa.org/journals/xlm/16/4/717/","http://scholar.google.com/scholar?cites=15776095553050627594&as_sdt=5,33&sciodt=0,33&hl=en&num=20",10,"2014-11-20",""
753,"A Einstein","equations of motionﬁ one therefore could not doubt that the laws of nature are",1907,"Jahrbuch der Radioaktivitﬁt and Elektronik","books.benjibear.com","","http://scholar.google.com/scholar?cites=8194474078555405789&as_sdt=5,33&sciodt=0,33&hl=en&num=20",11,"2014-11-20","PDF"
713,"A Einstein, L Infeld, B Hoffmann","The gravitational equations and the problem of motion",1938,"Annals of Mathematics","JSTOR","http://www.jstor.org/stable/1968714","http://scholar.google.com/scholar?cites=15597084872061545949&as_sdt=5,33&sciodt=0,33&hl=en&num=20",12,"2014-11-20",""
675,"A Einstein","Ist die Trägheit eines Körpers von seinem Energieinhalt abhängig?",1905,"Annalen der Physik","Wiley Online Library","http://onlinelibrary.wiley.com/doi/10.1002/andp.19053231314/abstract","http://scholar.google.com/scholar?cites=908327149963432204&as_sdt=5,33&sciodt=0,33&hl=en&num=20",13,"2014-11-20",""
723,"…, HH Ting, ND Shah, K Nasir, AJ Einstein…","Exposure to low-dose ionizing radiation from medical imaging procedures",2009,"… England Journal of …","Mass Medical Soc","http://www.nejm.org/doi/full/10.1056/nejmoa0901249","http://scholar.google.com/scholar?cites=16060325012458358658&as_sdt=5,33&sciodt=0,33&hl=en&num=20",14,"2014-11-20",""
659,"A Einstein","On the electrodynamics of moving bodies",1905,"Annalen der Physik","ganapathymani.com","","http://scholar.google.com/scholar?cites=8053935303508980710&as_sdt=5,33&sciodt=0,33&hl=en&num=20",15,"2014-11-20","PDF"
558,"A Einstein","Lens-like action of a star by the deviation of light in the gravitational field",1936,"Science","personalpages.to.infn.it","","http://scholar.google.com/scholar?cites=892297327537612244&as_sdt=5,33&sciodt=0,33&hl=en&num=20",16,"2014-11-20","PDF"
591,"A Einstein","The foundation of the general theory of relativity",1952,"The Principle of Relativity. Dover Books on Physics. …","adsabs.harvard.edu","","http://scholar.google.com/scholar?cites=10370726229868636479&as_sdt=5,33&sciodt=0,33&hl=en&num=20",17,"2014-11-20","CITATION"
566,"RR Hunt, GO Einstein","Relational and item-specific information in memory",1981,"Journal of Verbal Learning and Verbal Behavior","Elsevier","http://www.sciencedirect.com/science/article/pii/S0022537181901389","http://scholar.google.com/scholar?cites=13050270751302244265&as_sdt=5,33&sciodt=0,33&hl=en&num=20",18,"2014-11-20",""
541,"A Einstein","The world as I see it",2007,"","books.google.com","","http://scholar.google.com/scholar?cites=17183588468959488864&as_sdt=5,33&sciodt=0,33&hl=en&num=20",19,"2014-11-20","BOOK"
538,"A Einstein, N Rosen","The particle problem in the general theory of relativity",1935,"Physical Review","APS","http://journals.aps.org/pr/abstract/10.1103/PhysRev.48.73","http://scholar.google.com/scholar?cites=12603935438060482309&as_sdt=5,33&sciodt=0,33&hl=en&num=20",20,"2014-11-20",""
568,"AJ Einstein, KW Moser, RC Thompson, MD Cerqueira…","Radiation dose to patients from cardiac diagnostic imaging",2007,"Circulation","Am Heart Assoc","http://circ.ahajournals.org/content/116/11/1290.short","http://scholar.google.com/scholar?cites=1863072926880279141&as_sdt=5,33&sciodt=0,33&hl=en&num=20",21,"2014-11-20",""
515,"TL Einstein, JR Schrieffer","Indirect interaction between adatoms on a tight-binding solid",1973,"Physical Review B","APS","http://journals.aps.org/prb/abstract/10.1103/PhysRevB.7.3629","http://scholar.google.com/scholar?cites=8981146415182203614&as_sdt=5,33&sciodt=0,33&hl=en&num=20",22,"2014-11-20",""
561,"MA McDaniel, GO Einstein","Strategic and automatic processes in prospective memory retrieval: A multiprocess framework",2000,"Applied cognitive psychology","Wiley Online Library","http://onlinelibrary.wiley.com/doi/10.1002/acp.775/full","http://scholar.google.com/scholar?cites=15901562685763636197&as_sdt=5,33&sciodt=0,33&hl=en&num=20",23,"2014-11-20",""
505,"A EINSTEIN","Out of my later years",1950,"Soil Science","journals.lww.com","http://journals.lww.com/soilsci/Abstract/1950/06000/Out_of_My_Later_Years.11.aspx","http://scholar.google.com/scholar?cites=12407676397126373655&as_sdt=5,33&sciodt=0,33&hl=en&num=20",24,"2014-11-20",""
460,"A Einstein","The collected papers of Albert Einstein",1989,"","books.google.com","","http://scholar.google.com/scholar?cites=6706908336481689418&as_sdt=5,33&sciodt=0,33&hl=en&num=20",25,"2014-11-20","BOOK"
445,"…, JR Gilbert, SH Han, C Hulette, G Einstein…","Hypothesis: microtubule instability and paired helical filament formation in the Alzheimer disease brain are related to apolipoprotein E genotype",1994,"Experimental …","Elsevier","http://www.sciencedirect.com/science/article/pii/S0014488684710193","http://scholar.google.com/scholar?cites=6167924465654382153&as_sdt=5,33&sciodt=0,33&hl=en&num=20",26,"2014-11-20",""
441,"A Einstein","Physics and reality",1936,"Journal of the Franklin Institute","Elsevier","http://www.sciencedirect.com/science/article/pii/S0016003236910475","http://scholar.google.com/scholar?cites=6799563874330167610&as_sdt=5,33&sciodt=0,33&hl=en&num=20",27,"2014-11-20",""
429,"A Einstein","On the method of theoretical physics",1934,"Philosophy of science","JSTOR","http://www.jstor.org/stable/184387","http://scholar.google.com/scholar?cites=13957436534125297974&as_sdt=5,33&sciodt=0,33&hl=en&num=20",28,"2014-11-20",""
435,"GO Einstein, MA McDaniel, SL Richardson…","Aging and prospective memory: examining the influences of self-initiated retrieval processes.",1995,"Journal of …","psycnet.apa.org","http://psycnet.apa.org/journals/xlm/21/4/996/","http://scholar.google.com/scholar?cites=15683462803005509124&as_sdt=5,33&sciodt=0,33&hl=en&num=20",29,"2014-11-20",""
446,"…, JT Cox, DD Davey, MH Einstein…","American Cancer Society Guideline for human papillomavirus (HPV) vaccine use to prevent cervical cancer and its precursors",2007,"CA: A Cancer …","Wiley Online Library","","http://scholar.google.com/scholar?cites=10409636112556190409&as_sdt=5,33&sciodt=0,33&hl=en&num=20",30,"2014-11-20","HTML"
411,"GO Einstein, MA McDaniel…","Retrieval processes in prospective memory: Theoretical approaches and some new empirical findings",1996,"… memory: Theory and …","books.google.com","http://books.google.com/books?hl=en&lr=&id=uAvsAgAAQBAJ&oi=fnd&pg=PA115&dq=einstein&ots=Zz6AyUcSIh&sig=iMtjzS3jNmbBZx0zkWs87v0CISk","http://scholar.google.com/scholar?cites=10228439780222150839&as_sdt=5,33&sciodt=0,33&hl=en&num=20",31,"2014-11-20",""
402,"…, R Bach, DJ Blumenthal, D Einstein…","Optical performance monitoring",2004,"Journal of Lightwave …","opticsinfobase.org","http://www.opticsinfobase.org/abstract.cfm?uri=jlt-22-1-294","http://scholar.google.com/scholar?cites=4466005559632483778&as_sdt=5,33&sciodt=0,33&hl=en&num=20",32,"2014-11-20",""
410,"A Einstein, N Rosen","On gravitational waves",1937,"Journal of the Franklin Institute","Elsevier","http://www.sciencedirect.com/science/article/pii/S0016003237905830","http://scholar.google.com/scholar?cites=16415084652395903416&as_sdt=5,33&sciodt=0,33&hl=en&num=20",33,"2014-11-20",""
429,"HA Einstein","Formulas for the transportation of bed load",1942,"Transactions of the American Society of Civil Engineers","cedb.asce.org","","http://scholar.google.com/scholar?cites=4828683080429049424&as_sdt=5,33&sciodt=0,33&hl=en&num=20",34,"2014-11-20","CITATION"
391,"L Wu, M Einstein, WM Geissler, HK Chan…","Expression cloning and characterization of human 17 beta-hydroxysteroid dehydrogenase type 2, a microsomal enzyme possessing 20 alpha-hydroxysteroid …",1993,"Journal of biological …","ASBMB","http://www.jbc.org/content/268/17/12964.short","http://scholar.google.com/scholar?cites=8010914168469564245&as_sdt=5,33&sciodt=0,33&hl=en&num=20",35,"2014-11-20",""
401,"A Einstein","A new determination of molecular dimensions",1906,"Ann. Phys","","","http://scholar.google.com/scholar?cites=4214315397750728727&as_sdt=5,33&sciodt=0,33&hl=en&num=20",36,"2014-11-20","CITATION"
382,"A Einstein","UN THE MOVEMENT OF SMALL PARTICLES SUSPENDED IN STATIUNARY LIQUIDS REQUIRED BY THE MOLECULAR-KINETIC THEORY 0F HEAT",1905,"","old.stat.duke.edu","","http://scholar.google.com/scholar?cites=17058578111046495959&as_sdt=5,33&sciodt=0,33&hl=en&num=20",37,"2014-11-20","PDF"
392,"MA Brandimonte, GO Einstein, MA McDaniel","Prospective memory: Theory and applications",2014,"","books.google.com","","http://scholar.google.com/scholar?cites=12730903975985015788&as_sdt=5,33&sciodt=0,33&hl=en&num=20",38,"2014-11-20","BOOK"
400,"HA Einstein, NL Barbarossa","River channel roughness",1952,"… of the American Society of civil …","cedb.asce.org","","http://scholar.google.com/scholar?cites=16832633820386683638&as_sdt=5,33&sciodt=0,33&hl=en&num=20",39,"2014-11-20","CITATION"
380,"GO Einstein, RR Hunt","Levels of processing and organization: Additive effects of individual-item and relational processing.",1980,"Journal of Experimental Psychology: …","psycnet.apa.org","http://psycnet.apa.org/journals/xlm/6/5/588/","http://scholar.google.com/scholar?cites=8197786030060648537&as_sdt=5,33&sciodt=0,33&hl=en&num=20",40,"2014-11-20",""
369,"A Einstein","The field equations of gravitation",1913,"On a Heuristic Point of View about the Creation …","upload.wikimedia.org","","http://scholar.google.com/scholar?cites=11246957885394826280&as_sdt=5,33&sciodt=0,33&hl=en&num=20",41,"2014-11-20","PDF"
359,"A Einstein, G Straus","Gravitation. &ie.. cs Surrounc ing t.'xe:: ncivic ua.. Stars",1945,"","dafix.uark.edu","","http://scholar.google.com/scholar?cites=1352877977623266353&as_sdt=5,33&sciodt=0,33&hl=en&num=20",42,"2014-11-20","PDF"
331,"A Einstein, HA Lorentz, H Minkowski…","On the electrodynamics of moving bodies",1952,"The principle of …","mercury.pr.erau.edu","","http://scholar.google.com/scholar?cites=16556612620019609409&as_sdt=5,33&sciodt=0,33&hl=en&num=20",43,"2014-11-20","PDF"
339,"WS Dershowitz, HH Einstein","Characterizing rock joint geometry with joint system models",1988,"Rock Mechanics and Rock Engineering","Springer","http://www.springerlink.com/index/h714352837725640.pdf","http://scholar.google.com/scholar?cites=1160349323536916081&as_sdt=5,33&sciodt=0,33&hl=en&num=20",44,"2014-11-20",""
327,"A Einstein","The meaning of relativity",1950,"On a Heuristic Point of View about the Creation …","upload.wikimedia.org","http://upload.wikimedia.org/wikisource/en/5/55/On_a_Heuristic_Point_of_View_about_the_Creation_and_Conversion_of_Light_(1).pdf#page=91","http://scholar.google.com/scholar?cites=7196463446640404215&as_sdt=5,33&sciodt=0,33&hl=en&num=20",45,"2014-11-20",""
341,"A Einstein","On the movement of small particles suspended in stationary liquids required by the molecular-kinetic theory of heat",1905,"Annalen der Physik","engr.smu.edu","","http://scholar.google.com/scholar?cites=914776213665322352&as_sdt=5,33&sciodt=0,33&hl=en&num=20",46,"2014-11-20","PDF"
48,"P Einstein","Model of corrected transposition of the great arteries",1997,"US Patent 5,679,005","Google Patents","http://www.google.com/patents/US5679005","http://scholar.google.com/scholar?cites=16200957137512584721&as_sdt=5,33&sciodt=0,33&hl=en&num=20",47,"2014-11-20",""
318,"D Van der Heijde, R Landewe, S Einstein…","Radiographic progression of ankylosing spondylitis after up to two years of treatment with etanercept",2008,"Arthritis & …","Wiley Online Library","","http://scholar.google.com/scholar?cites=12248561604190374818&as_sdt=5,33&sciodt=0,33&hl=en&num=20",48,"2014-11-20","HTML"
288,"A Einstein","On a stationary system with spherical symmetry consisting of many gravitating masses",1939,"Annals of Mathematics","JSTOR","http://www.jstor.org/stable/1968902","http://scholar.google.com/scholar?cites=12800556622318901488&as_sdt=5,33&sciodt=0,33&hl=en&num=20",49,"2014-11-20",""
289,"N Chien, HA Einstein, HA Einstein, HA Einstein","Effects of heavy sediment concentration near the bed on velocity and sediment distribution",1955,"","Missoury River Division, Corps of …","","http://scholar.google.com/scholar?cites=17663269194836660176&as_sdt=5,33&sciodt=0,33&hl=en&num=20",50,"2014-11-20","CITATION"
299,"ER Stanley, KL Berg, DB Einstein…","Biology and action of colony‐stimulating factor‐1",1997,"Molecular …","Wiley Online Library","http://onlinelibrary.wiley.com/doi/10.1002/(SICI)1098-2795(199701)46:1%3C4::AID-MRD2%3E3.0.CO;2-V/abstract","http://scholar.google.com/scholar?cites=11053224880602786687&as_sdt=5,33&sciodt=0,33&hl=en&num=20",51,"2014-11-20",""
294,"GO Einstein, MA McDaniel, R Thomas…","Multiple processes in prospective memory retrieval: factors determining monitoring versus spontaneous retrieval.",2005,"Journal of …","psycnet.apa.org","http://psycnet.apa.org/journals/xge/134/3/327/","http://scholar.google.com/scholar?cites=5508639948893236576&as_sdt=5,33&sciodt=0,33&hl=en&num=20",52,"2014-11-20",""
280,"GB Baecher, NA Lanney, HH Einstein","Statistical description of rock properties and sampling",1977,"The 18th US Symposium on …","onepetro.org","http://scholar.google.comhttps://www.onepetro.org/conference-paper/ARMA-77-0400","http://scholar.google.com/scholar?cites=17549931819608968855&as_sdt=5,33&sciodt=0,33&hl=en&num=20",53,"2014-11-20",""
289,"HA Einstein, ESA El-Samni","Hydrodynamic forces on a rough wall",1949,"Reviews of modern physics","APS","http://journals.aps.org/rmp/abstract/10.1103/RevModPhys.21.520","http://scholar.google.com/scholar?cites=16708210214728081046&as_sdt=5,33&sciodt=0,33&hl=en&num=20",54,"2014-11-20",""
261,"A Einstein","Prinzipielles zur allgemeinen Relativitätstheorie",1918,"Annalen der Physik","Wiley Online Library","http://onlinelibrary.wiley.com/doi/10.1002/andp.19183600402/abstract","http://scholar.google.com/scholar?cites=4061534748172028485&as_sdt=5,33&sciodt=0,33&hl=en&num=20",55,"2014-11-20",""
271,"GO Einstein, LJ Holland, MA McDaniel…","Age-related deficits in prospective memory: The influence of task complexity.",1992,"Psychology and …","psycnet.apa.org","http://psycnet.apa.org/journals/pag/7/3/471/","http://scholar.google.com/scholar?cites=14448260090493685289&as_sdt=5,33&sciodt=0,33&hl=en&num=20",56,"2014-11-20",""
280,"A Bobet, HH Einstein","Fracture coalescence in rock-type materials under uniaxial and biaxial compression",1998,"International Journal of Rock Mechanics and Mining …","Elsevier","http://www.sciencedirect.com/science/article/pii/S0148906298000059","http://scholar.google.com/scholar?cites=4569201407426674753&as_sdt=5,33&sciodt=0,33&hl=en&num=20",57,"2014-11-20",""
4879,"A Einstein","Über die von der molekularkinetischen Theorie der Wärme geforderte Bewegung von in ruhenden Flüssigkeiten suspendierten Teilchen",1905,"Annalen der physik","Wiley Online Library","http://onlinelibrary.wiley.com/doi/10.1002/andp.19053220806/abstract","http://scholar.google.com/scholar?cites=2921717725886405222&as_sdt=5,33&sciodt=0,33&hl=en&num=20",58,"2014-11-20",""
281,"MA McDaniel, GOO Einstein","Prospective memory: An overview and synthesis of an emerging field",2007,"","Sage Publications","","http://scholar.google.com/scholar?cites=10329677107871376512&as_sdt=5,33&sciodt=0,33&hl=en&num=20",59,"2014-11-20","CITATION"
259,"…, DA Waldman, WO Einstein","Transformational leadership in a management game simulation impacting the bottom line",1988,"Group & Organization …","gom.sagepub.com","http://gom.sagepub.com/content/13/1/59.short","http://scholar.google.com/scholar?cites=7602209817640827296&as_sdt=5,33&sciodt=0,33&hl=en&num=20",60,"2014-11-20",""
251,"A Einstein, P Bergmann","On a generalization of Kaluza's theory of electricity",1938,"Annals of Mathematics","JSTOR","http://www.jstor.org/stable/1968642","http://scholar.google.com/scholar?cites=13095651482547476469&as_sdt=5,33&sciodt=0,33&hl=en&num=20",61,"2014-11-20",""
238,"N WIRTH, A EINSTEIN, YL MARUYAMA","Simulating expert systems and the Ethernet with ABELE",2003,"… of the Symposium on Decentralized, Event …","","","http://scholar.google.com/scholar?cites=6978921225945971342&as_sdt=5,33&sciodt=0,33&hl=en&num=20",62,"2014-11-20","CITATION"
244,"A Einstein, EG Straus","A generalization of the relativistic theory of gravitation, II",1946,"Annals of Mathematics","JSTOR","http://www.jstor.org/stable/1969231","http://scholar.google.com/scholar?cites=6188334212392197419&as_sdt=5,33&sciodt=0,33&hl=en&num=20",63,"2014-11-20",""
237,"M Ni, D Cui, J Einstein, S Narasimhulu…","Strength and tissue specificity of chimeric promoters derived from the octopine and mannopine synthase genes",1995,"The Plant …","Wiley Online Library","http://onlinelibrary.wiley.com/doi/10.1046/j.1365-313X.1995.7040661.x/abstract","http://scholar.google.com/scholar?cites=17404111400184287956&as_sdt=5,33&sciodt=0,33&hl=en&num=20",64,"2014-11-20",""
258,"MH Einstein, M Baron, MJ Levin…","Comparison of the immunogenicity and safety of Cervarix™ and Gardasil® human papillomavirus (HPV) cervical cancer vaccines in healthy women aged 18–45 …",2009,"Human …","landesbioscience.com","http://www.landesbioscience.com/journals/6/article/9518/","http://scholar.google.com/scholar?cites=13743899273377969518&as_sdt=5,33&sciodt=0,33&hl=en&num=20",65,"2014-11-20",""
233,"…, J Ellis, M Brandimonte, GO Einstein…","Varieties of intention: Some distinctions and classifications",1996,"… memory: Theory and …","books.google.com","http://books.google.com/books?hl=en&lr=&id=uAvsAgAAQBAJ&oi=fnd&pg=PA23&dq=einstein&ots=Zz6AyUcSIk&sig=JEloMmvX28_bPvRbPa_KXwftOUM","http://scholar.google.com/scholar?cites=1582898519588452121&as_sdt=5,33&sciodt=0,33&hl=en&num=20",66,"2014-11-20",""
228,"T Ben‐Hur, O Einstein, R Mizrachi‐Kol…","Transplanted multipotential neural precursor cells migrate into the inflamed white matter in response to experimental autoimmune encephalomyelitis",2003,"Glia","Wiley Online Library","http://onlinelibrary.wiley.com/doi/10.1002/glia.10159/full","http://scholar.google.com/scholar?cites=10332769450879750568&as_sdt=5,33&sciodt=0,33&hl=en&num=20",67,"2014-11-20",""
231,"AJ Einstein, MJ Henzlova, J Sanz…","Reply",2008,"Journal of Nuclear …","Springer","http://www.springerlink.com/index/8675M84703060M43.pdf","http://scholar.google.com/scholar?cites=16727612618147935902&as_sdt=5,33&sciodt=0,33&hl=en&num=20",68,"2014-11-20",""
219,"A Einstein, L Infeld","On the motion of particles in general relativity theory",1949,"Can. J. Math","","","http://scholar.google.com/scholar?cites=11297380142429183414&as_sdt=5,33&sciodt=0,33&hl=en&num=20",69,"2014-11-20","CITATION"
220,"A Einstein","Mozart, his character, his work",1962,"","books.google.com","","http://scholar.google.com/scholar?cites=3266138878696247126&as_sdt=5,33&sciodt=0,33&hl=en&num=20",70,"2014-11-20","BOOK"
3768,"A Einstein","Zur elektrodynamik bewegter körper",1905,"Annalen der physik","Wiley Online Library","http://onlinelibrary.wiley.com/doi/10.1002/andp.19053221004/abstract","http://scholar.google.com/scholar?cites=14896154263964907608&as_sdt=5,33&sciodt=0,33&hl=en&num=20",71,"2014-11-20",""
220,"A Einstein, W De Sitter","On the Relation between the Expansion and the Mean Density of the Universe",1932,"Proceedings of the National Academy of …","ncbi.nlm.nih.gov","http://www.ncbi.nlm.nih.gov/pmc/articles/PMC1076193/","http://scholar.google.com/scholar?cites=10151415472923143826&as_sdt=5,33&sciodt=0,33&hl=en&num=20",72,"2014-11-20",""
227,"HH Einstein","Special lecture: landslide risk assessment procedure",1988,"Proc. 5th Int. Symp. on Landslides, Lausanne","","","http://scholar.google.com/scholar?cites=13726943227123667241&as_sdt=5,33&sciodt=0,33&hl=en&num=20",73,"2014-11-20","CITATION"
218,"A Einstein","Music in the Romantic era",1947,"","Norton","","http://scholar.google.com/scholar?cites=11896008660390272298&as_sdt=5,33&sciodt=0,33&hl=en&num=20",74,"2014-11-20","CITATION"
214,"SH Han, G Einstein, KH Weisgraber…","Apolipoprotein E is localized to the cytoplasm of human cortical neurons: a light and electron microscopic study",1994,"… of Neuropathology & …","journals.lww.com","http://journals.lww.com/jneuropath/Abstract/1994/09000/Apolipoprotein_E_Is_Localized_to_the_Cytoplasm_of.13.aspx","http://scholar.google.com/scholar?cites=16113559870158240454&as_sdt=5,33&sciodt=0,33&hl=en&num=20",75,"2014-11-20",""
219,"A Einstein","Sidelights on relativity",1922,"","books.google.com","","http://scholar.google.com/scholar?cites=12831857969590545520&as_sdt=5,33&sciodt=0,33&hl=en&num=20",76,"2014-11-20","BOOK"
222,"A Einstein","Cosmological considerations on the general theory of relativity",1952,"The Principle of Relativity. Dover Books on Physics. …","adsabs.harvard.edu","","http://scholar.google.com/scholar?cites=2568546474801535936&as_sdt=5,33&sciodt=0,33&hl=en&num=20",77,"2014-11-20","CITATION"
215,"A Einstein","A generalization of the relativistic theory of gravitation",1945,"Annals of Mathematics","JSTOR","http://www.jstor.org/stable/1969197","http://scholar.google.com/scholar?cites=1904057624870791188&as_sdt=5,33&sciodt=0,33&hl=en&num=20",78,"2014-11-20",""
212,"A Einstein","Essays in science",2011,"","books.google.com","","http://scholar.google.com/scholar?cites=12684068162672357432&as_sdt=5,33&sciodt=0,33&hl=en&num=20",79,"2014-11-20","BOOK"
214,"H Benveniste, G Einstein, KR Kim…","Detection of neuritic plaques in Alzheimer's disease by magnetic resonance microscopy",1999,"Proceedings of the …","National Acad Sciences","http://www.pnas.org/content/96/24/14079.short","http://scholar.google.com/scholar?cites=12959016887997717448&as_sdt=5,33&sciodt=0,33&hl=en&num=20",80,"2014-11-20",""
209,"A Einstein","Geometry and experience",1921,"On a Heuristic Point of View about the Creation …","upload.wikimedia.org","","http://scholar.google.com/scholar?cites=7512954101354072652&as_sdt=5,33&sciodt=0,33&hl=en&num=20",81,"2014-11-20","PDF"
207,"NC Bartelt, TL Einstein, ED Williams","The influence of step-step interactions on step wandering",1990,"Surface science","Elsevier","http://www.sciencedirect.com/science/article/pii/003960289090722K","http://scholar.google.com/scholar?cites=13636625894979392535&as_sdt=5,33&sciodt=0,33&hl=en&num=20",82,"2014-11-20",""
209,"A Einstein, AH Krappe, R Sessions, WO Strunk","The Italian Madrigal",1949,"","Princeton University Press Princeton","","http://scholar.google.com/scholar?cites=10085538164352699681&as_sdt=5,33&sciodt=0,33&hl=en&num=20",83,"2014-11-20","CITATION"
208,"A Einstein","Erklarung der Perihelionbewegung der Merkur aus der allgemeinen Relativitatstheorie",1915,"Sitzungsber. preuss. Akad. Wiss., vol. 47, No. 2, pp. …","adsabs.harvard.edu","http://adsabs.harvard.edu/abs/1915SPAW...47..831E","http://scholar.google.com/scholar?cites=18441928015186612566&as_sdt=5,33&sciodt=0,33&hl=en&num=20",84,"2014-11-20",""
208,"MA McDaniel, MJ Guynn, GO Einstein…","Cue-focused and reflexive-associative processes in prospective memory retrieval.",2004,"Journal of …","psycnet.apa.org","http://psycnet.apa.org/journals/xlm/30/3/605/","http://scholar.google.com/scholar?cites=2010395757085521677&as_sdt=5,33&sciodt=0,33&hl=en&num=20",85,"2014-11-20",""
