Cites,Authors,Title,Year,Source,Publisher,ArticleURL,CitesURL,GSRank,QueryDate,Type
90,"AJ Einstein, SD Weiner, A Bernheim, M Kulon…","Multiple testing, cumulative radiation dose, and clinical indications in patients undergoing myocardial perfusion imaging",2010,"Jama","archinte.jamanetwork.com","http://archinte.jamanetwork.com/article.aspx?articleid=186917","http://scholar.google.com/scholar?cites=9984698267584754772&as_sdt=5,33&sciodt=0,33&hl=en&num=20",244,"2014-11-20",""
86,"S Suwansawat, HH Einstein","Artificial neural networks for predicting the maximum surface settlement caused by EPB shield tunneling",2006,"Tunnelling and Underground Space …","Elsevier","http://www.sciencedirect.com/science/article/pii/S0886779805000568","http://scholar.google.com/scholar?cites=258555818432318168&as_sdt=5,33&sciodt=0,33&hl=en&num=20",245,"2014-11-20",""
80,"PS Bisiacchi, M Brandimonte, GO Einstein…","The neuropsychological approach in the study of prospective memory",1996,"… memory: Theory and …","books.google.com","http://books.google.com/books?hl=en&lr=&id=uAvsAgAAQBAJ&oi=fnd&pg=PA297&dq=einstein&ots=Zz6AyUcTCk&sig=t3IetnXgyIsPzCJSyKb1VJz6deg","http://scholar.google.com/scholar?cites=11279852956637595873&as_sdt=5,33&sciodt=0,33&hl=en&num=20",246,"2014-11-20",""
104,"BE Condensation","A. Griffin, DW Snoke, and S. Stringari",1995,"Cambridge University Press","","","http://scholar.google.com/scholar?cites=13028335341935122077&as_sdt=5,33&sciodt=0,33&hl=en&num=20",247,"2014-11-20","CITATION"
82,"…, AM Meraney, LH Bernstein, DM Einstein…","Laparoscopic management of congenital seminal vesicle cysts associated with ipsilateral renal agenesis",2002,"The Journal of …","Elsevier","http://www.sciencedirect.com/science/article/pii/S0022534705652780","http://scholar.google.com/scholar?cites=14843345974147094051&as_sdt=5,33&sciodt=0,33&hl=en&num=20",248,"2014-11-20",""
79,"…, E HANSEN, AD CRABBE, HA EINSTEIN…","SEDIMENT TRANSPORT THEORIES.",1975,"ICE …","icevirtuallibrary.com","http://www.icevirtuallibrary.com/content/article/10.1680/iicep.1975.3740","http://scholar.google.com/scholar?cites=8857890994912135410&as_sdt=5,33&sciodt=0,33&hl=en&num=20",249,"2014-11-20",""
83,"W Lutz, J Lowry, SM Kopta, DA Einstein…","Prediction of dose–response relations based on patient characteristics",2001,"Journal of Clinical …","Wiley Online Library","http://onlinelibrary.wiley.com/doi/10.1002/jclp.1057/abstract","http://scholar.google.com/scholar?cites=17432122097901054629&as_sdt=5,33&sciodt=0,33&hl=en&num=20",250,"2014-11-20",""
80,"E Roboz Einstein, KB Dalal, J Csejtey","Biochemical maturation of the central nervous system. II. Protein and proteolytic enzyme changes",1970,"Brain research","Elsevier","http://www.sciencedirect.com/science/article/pii/0006899370904555","http://scholar.google.com/scholar?cites=43506647439719650&as_sdt=5,33&sciodt=0,33&hl=en&num=20",251,"2014-11-20",""
79,"EK Bayne, J Flanagan, M Einstein…","Immunohistochemical localization of types 1 and 2 5 -reductase in human scalp",1999,"British Journal of …","Wiley Online Library","http://onlinelibrary.wiley.com/doi/10.1046/j.1365-2133.1999.03042.x/full","http://scholar.google.com/scholar?cites=6132346319780567722&as_sdt=5,33&sciodt=0,33&hl=en&num=20",252,"2014-11-20",""
84,"FH Einstein, G Atzmon, X Yang, XH Ma, M Rincon…","Differential responses of visceral and subcutaneous fat depots to nutrients",2005,"Diabetes","Am Diabetes Assoc","http://diabetes.diabetesjournals.org/content/54/3/672.short","http://scholar.google.com/scholar?cites=11002347268628846088&as_sdt=5,33&sciodt=0,33&hl=en&num=20",253,"2014-11-20",""
84,"MH Einstein, KJ Park, Y Sonoda, J Carter, DS Chi…","Radical vaginal versus abdominal trachelectomy for stage IB1 cervical cancer: a comparison of surgical and pathologic outcomes",2009,"Gynecologic …","Elsevier","http://www.sciencedirect.com/science/article/pii/S0090825808007294","http://scholar.google.com/scholar?cites=1754913103107631327&as_sdt=5,33&sciodt=0,33&hl=en&num=20",254,"2014-11-20",""
83,"MH Einstein, AS Kadish, RD Burk, MY Kim…","Heat shock fusion protein-based immunotherapy for treatment of cervical intraepithelial neoplasia III",2007,"Gynecologic …","Elsevier","http://www.sciencedirect.com/science/article/pii/S0090825807003010","http://scholar.google.com/scholar?cites=15954308153192293147&as_sdt=5,33&sciodt=0,33&hl=en&num=20",255,"2014-11-20",""
84,"MA McDaniel, GO Einstein…","New considerations in aging and memory",2008,"The handbook of aging …","books.google.com","http://books.google.com/books?hl=en&lr=&id=YeJ4AgAAQBAJ&oi=fnd&pg=PA251&dq=einstein&ots=THxPKGMCEG&sig=_0OJvjf5FK5EMOv5-_PQjqsBIaU","http://scholar.google.com/scholar?cites=3431215120306442223&as_sdt=5,33&sciodt=0,33&hl=en&num=20",256,"2014-11-20",""
78,"PR Hof, H Duan, TL Page, M Einstein, B Wicinski, Y He…","Age-related changes in GluR2 and NMDAR1 glutamate receptor subunit protein immunoreactivity in corticocortically projecting neurons in macaque and patas …",2002,"Brain research","Elsevier","http://www.sciencedirect.com/science/article/pii/S0006899301033455","http://scholar.google.com/scholar?cites=3780478683336473643&as_sdt=5,33&sciodt=0,33&hl=en&num=20",257,"2014-11-20",""
77,"…, HC Rauch, ER Einstein","Immuno-electron microscopic localization of the encephalitogenic basic protein in myelin",1973,"Immunological …","informahealthcare.com","http://informahealthcare.com/doi/pdf/10.3109/08820137309022789","http://scholar.google.com/scholar?cites=1060216178760040591&as_sdt=5,33&sciodt=0,33&hl=en&num=20",258,"2014-11-20",""
79,"EL Glisky, M Brandimonte, GO Einstein…","Prospective memory and the frontal lobes",1996,"… memory: Theory and …","books.google.com","http://books.google.com/books?hl=en&lr=&id=uAvsAgAAQBAJ&oi=fnd&pg=PA249&dq=einstein&ots=Zz6AyUcTCk&sig=7vFYO04H-9dbi6elafQnoRJ1fGc","http://scholar.google.com/scholar?cites=11009734385616580184&as_sdt=5,33&sciodt=0,33&hl=en&num=20",259,"2014-11-20",""
76,"A Einstein","The influence of ubiquitous information on e-voting technology",1998,"","TOCS","","http://scholar.google.com/scholar?cites=11777297569878138707&as_sdt=5,33&sciodt=0,33&hl=en&num=20",260,"2014-11-20","CITATION"
79,"MA McDaniel, GO Einstein","Material-appropriate processing: A contextualist approach to reading and studying strategies",1989,"Educational Psychology Review","Springer","http://link.springer.com/article/10.1007/BF01326639","http://scholar.google.com/scholar?cites=1800211642059247637&as_sdt=5,33&sciodt=0,33&hl=en&num=20",261,"2014-11-20",""
78,"A Einstein","Relativity and the Problem of Space",1954,"Relativity, London: Methuen","","","http://scholar.google.com/scholar?cites=7617267150602630713&as_sdt=5,33&sciodt=0,33&hl=en&num=20",262,"2014-11-20","CITATION"
79,"A Einstein","Principles of research",1954,"","vvps-152670.dailyvps.co.uk","","http://scholar.google.com/scholar?cites=13920932988200128429&as_sdt=5,33&sciodt=0,33&hl=en&num=20",263,"2014-11-20","BOOK"
80,"L Zhang, HH Einstein","Estimating the intensity of rock discontinuities",2000,"International Journal of Rock Mechanics and Mining …","Elsevier","http://www.sciencedirect.com/science/article/pii/S1365160900000228","http://scholar.google.com/scholar?cites=10085260866855828306&as_sdt=5,33&sciodt=0,33&hl=en&num=20",264,"2014-11-20",""
659,"A Einstein","Zum quantensatz von Sommerfeld und Epstein",1917,"Verhandl. Dtsc. Phys. Ges.","cds.cern.ch","","http://scholar.google.com/scholar?cites=17947474147463319613&as_sdt=5,33&sciodt=0,33&hl=en&num=20",265,"2014-11-20","CITATION"
84,"A Bobet, HH Einstein","Numerical modeling of fracture coalescence in a model rock material",1998,"International Journal of Fracture","Springer","http://link.springer.com/article/10.1023/A:1007460316400","http://scholar.google.com/scholar?cites=2772584599905346004&as_sdt=5,33&sciodt=0,33&hl=en&num=20",266,"2014-11-20",""
78,"G Einstein, R Buranosky, BJ Crain","Dendritic pathology of granule cells in Alzheimer's disease is unrelated to neuritic plaques",1994,"The Journal of neuroscience","Soc Neuroscience","http://www.jneurosci.org/content/14/8/5077.short","http://scholar.google.com/scholar?cites=12490698178472100265&as_sdt=5,33&sciodt=0,33&hl=en&num=20",267,"2014-11-20",""
76,"D Pappagianis, H Einstein","Tempest from Tehachapi takes toll or Coccidioides conveyed aloft and afar",1978,"Western Journal of Medicine","ncbi.nlm.nih.gov","http://www.ncbi.nlm.nih.gov/pmc/articles/PMC1238466/","http://scholar.google.com/scholar?cites=15052733986146711785&as_sdt=5,33&sciodt=0,33&hl=en&num=20",268,"2014-11-20",""
82,"…, M Baker, J Hammel, D Einstein…","CT enterography for Crohn's disease: accurate preoperative diagnostic imaging",2007,"Diseases of the colon & …","Springer","http://link.springer.com/article/10.1007/s10350-007-9005-6","http://scholar.google.com/scholar?cites=8195490713034563191&as_sdt=5,33&sciodt=0,33&hl=en&num=20",269,"2014-11-20",""
75,"MA McDaniel, GO Einstein","Aging and prospective memory: Basic findings and practical applications",1992,"Advances in learning and behavioral disabilities","","","http://scholar.google.com/scholar?cites=5075914484156099036&as_sdt=5,33&sciodt=0,33&hl=en&num=20",270,"2014-11-20","CITATION"
75,"RE Drew, FWB Einstein","Crystal structure at-100. deg. of ammonium oxoperoxo (pyridine-2, 6-dicarboxylato) vanadate (V) hydrate, NH4 [VO (O2)(H2O)(C5H3N (COO) 2)]. xH2O (x. aeq. 1.3)",1973,"Inorganic Chemistry","ACS Publications","http://pubs.acs.org/doi/abs/10.1021/ic50122a025","http://scholar.google.com/scholar?cites=14870409299374557795&as_sdt=5,33&sciodt=0,33&hl=en&num=20",271,"2014-11-20",""
80,"IR Butler, WR Cullen, FWB Einstein, SJ Rettig…","Synthesis of some ring-substituted [1] ferrocenophanes and the structure of four representative examples",1983,"…","ACS Publications","http://pubs.acs.org/doi/abs/10.1021/om00073a024","http://scholar.google.com/scholar?cites=17363368274226637081&as_sdt=5,33&sciodt=0,33&hl=en&num=20",272,"2014-11-20",""
78,"RJ Batchelor, FWB Einstein, ID Gay…","Selenium coronands: synthesis and conformational analysis",1989,"Journal of the …","ACS Publications","http://pubs.acs.org/doi/abs/10.1021/ja00199a017","http://scholar.google.com/scholar?cites=4333768453236467729&as_sdt=5,33&sciodt=0,33&hl=en&num=20",273,"2014-11-20",""
79,"FWB Einstein, AH Klahn-Oliva, D Sutton…","Syntheses, x-ray structures, and cis-trans isomerism of (pentamethylcyclopentadienyl) dicarbonylrhenium dihalides (. eta.-C5Me5) Re (CO) 2X2 (X= Cl, Br, I)",1986,"Organometallics","ACS Publications","http://pubs.acs.org/doi/abs/10.1021/om00132a009","http://scholar.google.com/scholar?cites=17404101250919704125&as_sdt=5,33&sciodt=0,33&hl=en&num=20",274,"2014-11-20",""
77,"A Einstein, S Freud, S Gilbert","Why war?",1933,"","files.mundos-fantasticos.com","","http://scholar.google.com/scholar?cites=16750637826599032895&as_sdt=5,33&sciodt=0,33&hl=en&num=20",275,"2014-11-20","BOOK"
81,"DA Einstein, RG Menzies","The presence of magical thinking in obsessive compulsive disorder",2004,"Behaviour Research and Therapy","Elsevier","http://www.sciencedirect.com/science/article/pii/S0005796703001608","http://scholar.google.com/scholar?cites=16596882491289336739&as_sdt=5,33&sciodt=0,33&hl=en&num=20",276,"2014-11-20",""
75,"KB Dalal, ER Einstein","Biochemical maturation of the central nervous system: I. Lipid changes",1969,"Brain research","Elsevier","http://www.sciencedirect.com/science/article/pii/0006899369902376","http://scholar.google.com/scholar?cites=11927897037113714950&as_sdt=5,33&sciodt=0,33&hl=en&num=20",277,"2014-11-20",""
81,"…, C Dass, RM Kendzierski, EM Remer, DM Einstein…","Computer-aided Detection of Colorectal Polyps: Can It Improve Sensitivity of Less-Experienced Readers? Preliminary Findings 1",2007,"Radiology","pubs.rsna.org","http://pubs.rsna.org/doi/abs/10.1148/radiol.2451061116","http://scholar.google.com/scholar?cites=17759175981821104325&as_sdt=5,33&sciodt=0,33&hl=en&num=20",278,"2014-11-20",""
84,"…, I Cohen, PJ Slomka, AJ Einstein…","Stress thallium-201/rest technetium-99m sequential dual isotope high-speed myocardial perfusion imaging",2009,"JACC: …","Am Coll Cardio Found","","http://scholar.google.com/scholar?cites=4763911985928028314&as_sdt=5,33&sciodt=0,33&hl=en&num=20",279,"2014-11-20","HTML"
75,"MM Szabo, E Roboz-Einstein","Acidic polysaccharides in the central nervous system",1962,"Archives of Biochemistry and Biophysics","Elsevier","http://www.sciencedirect.com/science/article/pii/0003986162902059","http://scholar.google.com/scholar?cites=988847923630721450&as_sdt=5,33&sciodt=0,33&hl=en&num=20",280,"2014-11-20",""
74,"…, WM Usrey, BR Schofield, G Einstein","The sublaminar organization of corticogeniculate neurons in layer 6 of macaque striate cortex",1994,"Visual …","Cambridge Univ Press","http://journals.cambridge.org/abstract_S0952523800001656","http://scholar.google.com/scholar?cites=5044790708675901117&as_sdt=5,33&sciodt=0,33&hl=en&num=20",281,"2014-11-20",""
629,"A Einstein","Die plancksche theorie der strahlung und die theorie der spezifischen waerme",1906,"Annalen der Physik","Wiley Online Library","http://onlinelibrary.wiley.com/doi/10.1002/andp.19063270110/abstract","http://scholar.google.com/scholar?cites=5748591150372124458&as_sdt=5,33&sciodt=0,33&hl=en&num=20",282,"2014-11-20",""
74,"…, PV Preckel, ME Einstein","Development of a model to describe the compositional growth and dietary lysine requirements of pigs fed ractopamine",2003,"Journal of Animal …","journalofanimalscience.org","http://www.journalofanimalscience.org/content/81/5/1106.short","http://scholar.google.com/scholar?cites=570723367723462929&as_sdt=5,33&sciodt=0,33&hl=en&num=20",283,"2014-11-20",""
78,"MA McDaniel, GO Einstein, AC Stout…","Aging and maintaining intentions over delays: do it or lose it.",2003,"Psychology and …","psycnet.apa.org","http://psycnet.apa.org/journals/pag/18/4/823/","http://scholar.google.com/scholar?cites=15323075776429082707&as_sdt=5,33&sciodt=0,33&hl=en&num=20",284,"2014-11-20",""
78,"HA Einstein, AG Anderson…","A distinction between bed-load and suspended load in natural streams",1940,"Transactions, American …","adsabs.harvard.edu","http://adsabs.harvard.edu/abs/1940TrAGU..21..628E","http://scholar.google.com/scholar?cites=2154408369943033349&as_sdt=5,33&sciodt=0,33&hl=en&num=20",285,"2014-11-20",""
73,"AJ Einstein, HS Wu, M Sanchez…","Fractal characterization of chromatin appearance for diagnosis in breast cytology",1998,"The Journal of pathology","Wiley Online Library","http://onlinelibrary.wiley.com/doi/10.1002/(SICI)1096-9896(199808)185:4%3C366::AID-PATH122%3E3.0.CO;2-C/abstract","http://scholar.google.com/scholar?cites=14773188924809438847&as_sdt=5,33&sciodt=0,33&hl=en&num=20",286,"2014-11-20",""
609,"A Einstein","Über den Einfluß der Schwerkraft auf die Ausbreitung des Lichtes",1911,"Annalen der Physik","Wiley Online Library","http://onlinelibrary.wiley.com/doi/10.1002/andp.19113401005/abstract","http://scholar.google.com/scholar?cites=356611020974606516&as_sdt=5,33&sciodt=0,33&hl=en&num=20",287,"2014-11-20",""
74,"…, JA Bianco, AJ Taylor, M Einstein…","Pilot study using PET/CT as a novel, noninvasive assessment of disease activity in inflammatory bowel disease",2007,"Inflammatory bowel …","Wiley Online Library","","http://scholar.google.com/scholar?cites=3125762499856416292&as_sdt=5,33&sciodt=0,33&hl=en&num=20",288,"2014-11-20","HTML"
76,"L Zhang, HH Einstein","Using RQD to estimate the deformation modulus of rock masses",2004,"International Journal of Rock Mechanics and …","Pergamon","","http://scholar.google.com/scholar?cites=16525424831206427403&as_sdt=5,33&sciodt=0,33&hl=en&num=20",289,"2014-11-20","CITATION"
71,"NC Bartelt, TL Einstein, LD Roelofs","Theory and feasibility of using low-energy electron diffraction to study specific-heat anomalies at surface phase transitions",1985,"Physical Review B","APS","http://journals.aps.org/prb/abstract/10.1103/PhysRevB.32.2993","http://scholar.google.com/scholar?cites=9017055012834561289&as_sdt=5,33&sciodt=0,33&hl=en&num=20",290,"2014-11-20",""
73,"L Lee, DJ Berg, FW Einstein, RJ Batchelor","Synthesis, X-ray Crystal Structure, and Reactivity of Y (MAC)(CH2SiMe3) 2 (MAC= Deprotonated aza-18-crown-6)",1997,"Organometallics","ACS Publications","http://pubs.acs.org/doi/abs/10.1021/om960708f","http://scholar.google.com/scholar?cites=4789402786817228443&as_sdt=5,33&sciodt=0,33&hl=en&num=20",291,"2014-11-20",""
72,"HE Einstein, CW Holeman Jr, LL Sandidge…","Coccidioidal meningitis—the use of amphotericin B in treatment",1961,"California …","ncbi.nlm.nih.gov","http://www.ncbi.nlm.nih.gov/pmc/articles/PMC1574376/","http://scholar.google.com/scholar?cites=10053626811620745334&as_sdt=5,33&sciodt=0,33&hl=en&num=20",292,"2014-11-20",""
69,"TL Einstein, R Vanselow, RF Howe","Chemistry and Physics of Solid Surfaces",1979,"CRC, Boca Raton","","","http://scholar.google.com/scholar?cites=3070466602130708609&as_sdt=5,33&sciodt=0,33&hl=en&num=20",293,"2014-11-20","CITATION"
580,"A Einstein","Die feldgleichungen der gravitation",1915,"… Akademie der Wissenschaften (Berlin), Seite 844- …","adsabs.harvard.edu","","http://scholar.google.com/scholar?cites=8066420215978626200&as_sdt=5,33&sciodt=0,33&hl=en&num=20",294,"2014-11-20","CITATION"
68,"…, R Johnson, D Pappagianis, H Einstein…","Vasculitic and encephalitic complications associated with Coccidioides immitis infection of the central nervous system in humans: report of 10 cases and review",1992,"Clinical infectious …","cid.oxfordjournals.org","http://cid.oxfordjournals.org/content/14/3/673.short","http://scholar.google.com/scholar?cites=18106925151715426627&as_sdt=5,33&sciodt=0,33&hl=en&num=20",295,"2014-11-20",""
77,"C Papenhausen, W Einstein","Implementing the Balanced Scorecard at a college of business",2006,"Measuring Business Excellence","ingentaconnect.com","http://www.ingentaconnect.com/content/mcb/267/2006/00000010/00000003/art00002","http://scholar.google.com/scholar?cites=15827943863096983113&as_sdt=5,33&sciodt=0,33&hl=en&num=20",296,"2014-11-20",""
69,"GT Silvestri, JM Lukasiewicz, ME Einstein","Occupational employment projections through 1995",1983,"Monthly Labor Review","JSTOR","http://www.jstor.org/stable/41842121","http://scholar.google.com/scholar?cites=10459208447613896446&as_sdt=5,33&sciodt=0,33&hl=en&num=20",297,"2014-11-20",""
69,"WR Cullen, TJ Kim, FWB Einstein, T Jones","Structure of the hydrogenation catalyst [(PP) Rh (NBD)] ClO4, PP=(. eta. 5-(Me3C) 2PC5H4) 2Fe, and some comparative rate studies",1983,"Organometallics","ACS Publications","http://pubs.acs.org/doi/abs/10.1021/om00078a004","http://scholar.google.com/scholar?cites=12457909504565154347&as_sdt=5,33&sciodt=0,33&hl=en&num=20",298,"2014-11-20",""
73,"KM Burkholder, KL Thompson, ME Einstein…","Influence of stressors on normal intestinal microbiota, intestinal morphology, and susceptibility to Salmonella enteritidis colonization in broilers",2008,"Poultry …","ps.oxfordjournals.org","http://ps.oxfordjournals.org/content/87/9/1734.short","http://scholar.google.com/scholar?cites=16811388760843686976&as_sdt=5,33&sciodt=0,33&hl=en&num=20",299,"2014-11-20",""
69,"LP Chao, ER Einstein","PHYSICAL PROPERTIES OF THE BOVINE ENCEPHALITOGENIC PROTEIN; MOLECULAR WEIGHT AND CONFORMATION1",1970,"Journal of neurochemistry","Wiley Online Library","http://onlinelibrary.wiley.com/doi/10.1111/j.1471-4159.1970.tb03360.x/full","http://scholar.google.com/scholar?cites=6961656523251202148&as_sdt=5,33&sciodt=0,33&hl=en&num=20",300,"2014-11-20",""
74,"KS Kunzelman, DR Einstein…","Fluid–structure interaction models of the mitral valve: function in normal and pathological states",2007,"… of the Royal …","rstb.royalsocietypublishing.org","http://rstb.royalsocietypublishing.org/content/362/1484/1393.short","http://scholar.google.com/scholar?cites=1278957497358882040&as_sdt=5,33&sciodt=0,33&hl=en&num=20",301,"2014-11-20",""
69,"QJ Cao, MH Einstein, PS Anderson…","Expression of COX-2, Ki-67, cyclin D1, and P21 in endometrial endometrioid carcinomas",2002,"International Journal …","journals.lww.com","http://journals.lww.com/intjgynpathology/Abstract/2002/04000/Expression_of_COX_2,_Ki_67,_Cyclin_D1,_and_P21_in.7.aspx","http://scholar.google.com/scholar?cites=2352823895010448583&as_sdt=5,33&sciodt=0,33&hl=en&num=20",302,"2014-11-20",""
68,"F Einstein, RF Thompson, TD Bhagat, MJ Fazzari…","Cytosine methylation dysregulation in neonates following intrauterine growth restriction",2010,"PloS one","dx.plos.org","","http://scholar.google.com/scholar?cites=153978118523540168&as_sdt=5,33&sciodt=0,33&hl=en&num=20",303,"2014-11-20","HTML"
66,"RE Drew, FWB Einstein","Crystal structure of ammonium oxodiperoxoamminevanadate (V)",1972,"Inorganic Chemistry","ACS Publications","http://pubs.acs.org/doi/abs/10.1021/ic50111a033","http://scholar.google.com/scholar?cites=3160288388358485990&as_sdt=5,33&sciodt=0,33&hl=en&num=20",304,"2014-11-20",""
69,"TL Einstein","The three-adatom non-pairwise (“trio”) interaction, with implications for Monte Carlo simulations of O/W (110)",1979,"Surface Science","Elsevier","http://www.sciencedirect.com/science/article/pii/0039602879901547","http://scholar.google.com/scholar?cites=16506003809184185951&as_sdt=5,33&sciodt=0,33&hl=en&num=20",305,"2014-11-20",""
69,"MA McDaniel, GO Einstein…","The puzzle of inconsistent age-related declines in prospective memory: A multiprocess explanation.",2008,"… were reported in part at the …","psycnet.apa.org","http://psycnet.apa.org/psycinfo/2007-15727-007","http://scholar.google.com/scholar?cites=11504775555950197519&as_sdt=5,33&sciodt=0,33&hl=en&num=20",306,"2014-11-20",""
66,"Y Xu, RJ Mural, JR Einstein, MB Shah…","GRAIL: A multi-agent neural network system for gene identification",1996,"Proceedings of the …","ieeexplore.ieee.org","http://ieeexplore.ieee.org/xpls/abs_all.jsp?arnumber=537117","http://scholar.google.com/scholar?cites=16444035597437098572&as_sdt=5,33&sciodt=0,33&hl=en&num=20",307,"2014-11-20",""
69,"A Einstein","On the relativity principle and the conclusions drawn from it",1907,"Jahrbuch der Radioaktivität und Elektronik","","","http://scholar.google.com/scholar?cites=8088526843763630697&as_sdt=5,33&sciodt=0,33&hl=en&num=20",308,"2014-11-20","CITATION"
65,"A Einstein, RC Tolman, B Podolsky","Knowledge of past and future in quantum mechanics",1931,"Physical Review","authors.library.caltech.edu","http://authors.library.caltech.edu/2129/","http://scholar.google.com/scholar?cites=15603169365312656105&as_sdt=5,33&sciodt=0,33&hl=en&num=20",309,"2014-11-20",""
67,"SA Stabinsky, M Einstein, JL Breen","Modern treatments of menorrhagia attributable to dysfunctional uterine bleeding",1999,"Obstetrical & gynecological …","journals.lww.com","http://journals.lww.com/obgynsurvey/Abstract/1999/01000/Modern_Treatments_of_Menorrhagia_Attributable_to.25.aspx","http://scholar.google.com/scholar?cites=4338538183330767553&as_sdt=5,33&sciodt=0,33&hl=en&num=20",310,"2014-11-20",""
67,"MA Nicosia, RP Cochran, DR Einstein…","A coupled fluid-structure finite element model of the aortic valve and root.",2003,"The Journal of heart …","europepmc.org","http://europepmc.org/abstract/med/14658821","http://scholar.google.com/scholar?cites=17951142287576096465&as_sdt=5,33&sciodt=0,33&hl=en&num=20",311,"2014-11-20",""
66,"ML Den Boer, TL Einstein, WT Elam, RL Park…","Extended Appearance-Potential Fine-Structure Analysis: Oxygen on Al (100)",1980,"Physical Review Letters","APS","http://journals.aps.org/prl/abstract/10.1103/PhysRevLett.44.496","http://scholar.google.com/scholar?cites=10499911731458506912&as_sdt=5,33&sciodt=0,33&hl=en&num=20",312,"2014-11-20",""
77,"…, K Pillai, RJ Maciunas, DB Einstein","12 Gy gamma knife radiosurgical volume is a predictor for radiation necrosis in non-AVM intracranial tumors",2006,"International Journal of …","Elsevier","http://www.sciencedirect.com/science/article/pii/S0360301605023692","http://scholar.google.com/scholar?cites=14479196063983572179&as_sdt=5,33&sciodt=0,33&hl=en&num=20",313,"2014-11-20",""
70,"MA McDaniel, DC Howard, GO Einstein","The Read-Recite-Review Study Strategy Effective and Portable",2009,"Psychological Science","pss.sagepub.com","http://pss.sagepub.com/content/20/4/516.short","http://scholar.google.com/scholar?cites=15390675179183772781&as_sdt=5,33&sciodt=0,33&hl=en&num=20",314,"2014-11-20",""
67,"TH Wu, WH Tang, HH Einstein","Landslide hazard and risk assessment",1996,"… Research Board Special Report. National Academy …","","","http://scholar.google.com/scholar?cites=5600282363946926041&as_sdt=5,33&sciodt=0,33&hl=en&num=20",315,"2014-11-20","CITATION"
81,"J Chen, AJ Einstein, R Fazel…","Cumulative Exposure to Ionizing Radiation From Diagnostic and Therapeutic Cardiac Imaging ProceduresA Population-Based Analysis",2010,"Journal of the …","Am Coll Cardio Found","","http://scholar.google.com/scholar?cites=16290595190020380130&as_sdt=5,33&sciodt=0,33&hl=en&num=20",316,"2014-11-20","HTML"
66,"WR Cullen, FWB Einstein, CH Huang…","Asymmetric hydrogenation catalyzed by cationic ferrocenylphosphine rhodium (I) complexes and the crystal structure of a catalyst precursor",1980,"Journal of the …","ACS Publications","http://pubs.acs.org/doi/abs/10.1021/ja00523a014","http://scholar.google.com/scholar?cites=4793021541939784638&as_sdt=5,33&sciodt=0,33&hl=en&num=20",317,"2014-11-20",""
65,"A Einstein","Collected scientific papers",1965,"","cds.cern.ch","","http://scholar.google.com/scholar?cites=17451271617546323517&as_sdt=5,33&sciodt=0,33&hl=en&num=20",318,"2014-11-20","CITATION"
67,"A Einstein","Religion and science",1930,"","documents.epfl.ch","","http://scholar.google.com/scholar?cites=4469592885480500975&as_sdt=5,33&sciodt=0,33&hl=en&num=20",319,"2014-11-20","BOOK"
